,Autor(es),Título,GT,Evento,Ano,Link do Arquivo
1216,,OS DESAFIOS DA EDUCAÇÃO ESCOLAR QUILOMBOLA NO CONTEXTO DA PANDEMIA DA COVID- 19 EM UMA COMUNIDADE NO MUNICÍPIO DE BARREIRINHA – AM,"GT03 - Movimentos sociais, sujeitos e processos educativos",40,2017-2021,http://anais.anped.org.br/sites/default/files/arquivos_25_21.
1217,,OS EIXOS DE COLONIALIDADE E O ENSINO DE MATEMÁTICA NA AMAZÔNIA.,GT19 - Educação Matemática,40,2017-2021,http://anais.anped.org.br/sites/default/files/arquivos_26_21.
1218,,OS GRUPOS DE PESQUISA EM EDUCAÇÃO INFANTIL NO BRASIL: UM ESTUDO A PARTIR DO REPOSITÓRIO DO DGP/CNPq,GT07 - Educação de Crianças de 0 a 6 anos,40,2017-2021,http://anais.anped.org.br/sites/default/files/arquivos_27_21.
1219,,OS HOMENS DO LIVRO: LIVROS PROTESTANTES NO BRASIL DO SÉCULO XIX,GT02 – História da Educação,40,2017-2021,http://anais.anped.org.br/sites/default/files/arquivos_28_25.
1220,,OS JOGOS TEATRAIS NO PROCESSO DE ALFABETIZAÇÃO DISCURSIVA,"GT10 - Alfabetização, Leitura e Escrita",40,2017-2021,http://anais.anped.org.br/sites/default/files/arquivos_29_21.
1221,,OS MOVIMENTOS DE PARTICIPAÇÃO DOS BEBÊS EM UMA TURMA DE BERÇÁRIO: ENTRE AS CULTURAS INFANTIS E UMA CULTURA ADULTA SENSÍVEL NA EDUCAÇÃO INFANTIL,GT07 - Educação de Crianças de 0 a 6 anos,40,2017-2021,http://anais.anped.org.br/sites/default/files/arquivos_30_21.
1222,,OS PROCESSOS CRIATIVOS NA CONSTRUÇÃO DE PERSONAGENS NEGRAS(OS) NOS LIVROS DE LITERATURA INFANTIL DO PNBE,GT21 - Educação e Relações Étnico-Raciais,40,2017-2021,http://anais.anped.org.br/sites/default/files/arquivos_31_21.
1223,,OS SENTIDOS ATRIBUÍDOS AS COTAS RACIAIS POR JOVENS NEGROS(AS) E BRANCOS(AS) ESTUDANTES DO ENSINO MÉDIO,GT21 - Educação e Relações Étnico-Raciais,40,2017-2021,http://anais.anped.org.br/sites/default/files/arquivos_32_21.
1224,,Os sentidos da escrita para crianças frente à proposta de texto livre,"GT10 - Alfabetização, Leitura e Escrita",40,2017-2021,http://anais.anped.org.br/sites/default/files/arquivos_33_21.
1225,,O SURDO NOS DISCURSOS DO CURRÍCULO: QUEM É ESTE SUJEITO?,GT15 - Educação Especial,40,2017-2021,http://anais.anped.org.br/sites/default/files/arquivos_34_21.
1226,,O tempo na consolidação de saberes docentes: um estudo de caso envolvendo docentes do ensino médio paulista,GT04 - Didática,40,2017-2021,http://anais.anped.org.br/sites/default/files/arquivos_35_21.
1227,,O TERMO PENSAMENTO COMPUTACIONAL NA EDUCAÇÃO MATEMÁTICA SEGUNDO CONTRIBUIÇÕES DA TEORIA HISTÓRICO-CULTURAL,GT19 - Educação Matemática,40,2017-2021,http://anais.anped.org.br/sites/default/files/arquivos_36_20.
1228,,O Trabalho Colaborativo entre o professor de Educação Especial que atua na Sala de Recursos Multifuncionais e o do ensino comum,GT20 - Psicologia da Educação,40,2017-2021,http://anais.anped.org.br/sites/default/files/arquivos_37_20.
1229,,O VOTO FEMININO À LUZ DOS DISCURSOS DA ESCRITORA MARIA EUGENIA CELSO (1927-1932),GT02 – História da Educação,40,2017-2021,http://anais.anped.org.br/sites/default/files/arquivos_38_24.
1230,,Páginas em branco não contam histórias negras: o lugar das narrativas afrodiaspóricas nos cotidianos escolares,GT21 - Educação e Relações Étnico-Raciais,40,2017-2021,http://anais.anped.org.br/sites/default/files/arquivos_39_20.
1231,,PANDEMIA DE COVID-19 E PRÁTICAS DE LEITURA DE JOVENS CONCLUINTES DO ENSINO TÉCNICO DE NÍVEL MÉDIO: APONTAMENTOS PARA PENSAR O FUTURO DA FORMAÇÃO DE LEITORES JOVENS,"GT10 - Alfabetização, Leitura e Escrita",40,2017-2021,http://anais.anped.org.br/sites/default/files/arquivos_40_20.
1232,,Panorama da formação de professores em Educação Especial no Brasil.,GT15 - Educação Especial,40,2017-2021,http://anais.anped.org.br/sites/default/files/arquivos_41_20.
1233,,PARA ALÉM DAS PAREDES DA SALA DE AULA: A EDUCAÇÃO BIOFÍLICA PARA BEBÊS E CRIANÇAS PEQUENINAS.,GT07 - Educação de Crianças de 0 a 6 anos,40,2017-2021,http://anais.anped.org.br/sites/default/files/arquivos_42_20.
1234,,PARACOSMO: IMAGINAÇÃO E PRODUÇÃO NARRATIVA,GT16 - Educação e Comunicação,40,2017-2021,http://anais.anped.org.br/sites/default/files/arquivos_43_20.
1235,,PARÂMETROS DOS DOCUMENTOS OFICIAIS DO CERI/OCDE SOBRE A INOVAÇÃO PEDAGÓGICA NA FORMAÇÃO DE PROFESSORES,GT08 - Formação de Professores,40,2017-2021,http://anais.anped.org.br/sites/default/files/arquivos_44_20.
1236,,"PARTICIPAÇÃO DAS FAMÍLIAS NA AVALIAÇÃO INSTITUCIONAL NA EDUCAÇÃO INFANTIL: TENSÕES, DESAFIOS E PERSPECTIVAS",GT07 - Educação de Crianças de 0 a 6 anos,40,2017-2021,http://anais.anped.org.br/sites/default/files/arquivos_45_20.
1237,,PARTICIPAÇÃO JUVENIL EM ESCOLAS PÚBLICAS BRASILEIRAS DE ENSINO MÉDIO: EXPERIÊNCIAS ESTUDANTIS E CONFRONTO POLÍTICO NO INTERIOR DO MUNDO ESCOLAR,"GT03 - Movimentos sociais, sujeitos e processos educativos",40,2017-2021,http://anais.anped.org.br/sites/default/files/arquivos_46_20.
1238,,PARTICIPAÇÃO JUVENIL EM RODAS DE CONVERSA: CONTRIBUIÇÕES DA EDUCAÇÃO POPULAR PARA AÇÃO PASTORAL UNIVERSITÁRIA,GT06 - Educação Popular,40,2017-2021,http://anais.anped.org.br/sites/default/files/arquivos_47_20.
1239,,Particularidades da Precarização do Trabalho Docente no Sistema Semipresencial: O Contexto de Uma Instituição de Ensino Superior Privada-Mercantil,GT11 - Política da Educação Superior,40,2017-2021,http://anais.anped.org.br/sites/default/files/arquivos_48_14.
1240,,PATRIMÔNIO ESCOLAR CATÓLICO NO RIO DE JANEIRO: UMA PESQUISA EM CONSTRUÇÃO,GT02 – História da Educação,40,2017-2021,http://anais.anped.org.br/sites/default/files/arquivos_49_24.
1241,,NARRATIVAS DE PROFESSORES NÃO LICENCIADOS NA EDUCAÇÃO BÁSICA: SENTIDOS DE DOCÊNCIA,GT08 - Formação de Professores,40,2017-2021,http://anais.anped.org.br/sites/default/files/arquivos_0_22.
1242,,NARRATIVAS DOCENTES EM REDES LATINO - AMERICANAS: EXPERIÊNCIAS FORMATIVAS NA EDUCAÇÃO FUNDAMENTAL,GT13 - Educação Fundamental,40,2017-2021,http://anais.anped.org.br/sites/default/files/arquivos_1_23.
1243,,"NARRATIVAS PARTILHADAS ENTRE FOTOGRAFIAS, MEMÓRIAS E CONHECIMENTOS",GT16 - Educação e Comunicação,40,2017-2021,http://anais.anped.org.br/sites/default/files/arquivos_2_22.
1244,,NARRATIVAS SURDAS NA PÓS-GRADUAÇÃO: ALFABETIZAÇÃO E LETRAMENTO EM FOCO,"GT10 - Alfabetização, Leitura e Escrita",40,2017-2021,http://anais.anped.org.br/sites/default/files/arquivos_3_22.
1245,,"Nas trilhas com Robin Hood: sobre liberdade, presença e cuidado na educação",GT13 - Educação Fundamental,40,2017-2021,http://anais.anped.org.br/sites/default/files/arquivos_4_22.
1246,,"NATUREZA, MULHERES E REPRODUÇÃO SOCIAL",GT22 - Educação Ambiental,40,2017-2021,http://anais.anped.org.br/sites/default/files/arquivos_5_22.
1247,,NEGOCIAÇÃO E PARTICIPAÇÃO INFANTIL: O QUE AS CRIANÇAS NOS REVELAM SOBRE OS MODOS DE PARTICIPAÇÃO NA PRÁTICA PEDAGÓGICA?,GT07 - Educação de Crianças de 0 a 6 anos,40,2017-2021,http://anais.anped.org.br/sites/default/files/arquivos_6_22.
1248,,“NENHUMA OUTRA INSTITUIÇÃO É TÃO ASSOMBROSAMENTE ÚTIL”: A UNIVERSIDADE NO PENSAMENTO DE ANÍSIO TEIXEIRA (ANOS 1930 E 1950),GT02 – História da Educação,40,2017-2021,http://anais.anped.org.br/sites/default/files/arquivos_7_26.
1249,,Nome social na educação superior: O acesso de transexuais e travestis,GT11 - Política da Educação Superior,40,2017-2021,http://anais.anped.org.br/sites/default/files/arquivos_8_28.
1250,,NO RASTRO DE TRILHAS SENSÍVEIS PARA PENSAR AS RELAÇÕES ÉTNICO RACIAIS NA ESCOLA,GT21 - Educação e Relações Étnico-Raciais,40,2017-2021,http://anais.anped.org.br/sites/default/files/arquivos_9_22.
1251,,"NOTA ESCOLAR : CORPO, MEMÓRIA, CULTURA VISUAL E COTIDIANOS",GT24 - Educação e Arte,40,2017-2021,http://anais.anped.org.br/sites/default/files/arquivos_10_22.
1252,,Notas sobre a arquitetura escolar do Instituto Santa Teresinha no município de Bragança,GT02 – História da Educação,40,2017-2021,http://anais.anped.org.br/sites/default/files/arquivos_11_28.
1253,,NOVA ECONOMIA E PRODUÇÃO DE SUBJETIVIDADES: DESDOBRAMENTOS PARA A EDUCAÇÃO EM RICHARD SENNET,GT17 - Filosofia da Educação,40,2017-2021,http://anais.anped.org.br/sites/default/files/arquivos_12_22.
1254,,NOVO FUNDEB: VOCÊ SABE O VALOR ($) DISSO PARA O BRASIL?,GT05 - Estado e Política Educacional,40,2017-2021,http://anais.anped.org.br/sites/default/files/arquivos_13_22.
1255,,O ACESSO DA CLASSE TRABALHADORA AOS PROGRAMAS DE INTERC MBIO: UMA ANÁLISE DAS POLÍTICAS PÚBLICAS PARA A INTERNACIONALIZAÇÃO DA EDUCAÇÃO SUPERIOR,GT11 - Política da Educação Superior,40,2017-2021,http://anais.anped.org.br/sites/default/files/arquivos_14_28.
1256,,O ALFABETISMO FUNCIONAL E A SUA RELAÇÃO COM A FORMAÇÃO DE COMPETÊNCIAS E HABILIDADES: a formação do trabalhador flexível na escola,GT05 - Estado e Política Educacional,40,2017-2021,http://anais.anped.org.br/sites/default/files/arquivos_15_22.
1257,,O ALUNO E A ESCOLA: REFLEXÕES SOBRE SUPERAÇÃO DO ENSINO INSTRUCIONISTA NO ENSINO FUNDAMENTAL,GT04 - Didática,40,2017-2021,http://anais.anped.org.br/sites/default/files/arquivos_16_22.
1258,,O apelo tecnológico da facilidade: Serious Games e Gameficação,GT17 - Filosofia da Educação,40,2017-2021,http://anais.anped.org.br/sites/default/files/arquivos_17_22.
1259,,O atendimento pedagógico hospitalar e o tratamento da doença: enfoque nas narrativas de crianças hospitalizadas,GT15 - Educação Especial,40,2017-2021,http://anais.anped.org.br/sites/default/files/arquivos_18_22.
1260,,OBEDIÊNCIA E DESOBEDIÊNCIA NO COTIDIANO DA ESCOLA: DIÁLOGOS ENTRE A PSICANÁLISE HUMANISTA DE ERICH FROMM E A PEDAGOGIA LIBERTADORA DE PAULO FREIRE,GT17 - Filosofia da Educação,40,2017-2021,http://anais.anped.org.br/sites/default/files/arquivos_19_22.
1261,,"OBRA COREOGRÁFICA: EXPRESSÃO DE EDUCAÇÃO, INTERCORPOREIDADE E CULTURA.",GT24 - Educação e Arte,40,2017-2021,http://anais.anped.org.br/sites/default/files/arquivos_20_22.
1262,,OBRIGATORIEDADE ESCOLAR NA PRÉ-ESCOLA: PERCEPÇÃO DE FAMÍLIAS E PROFISSIONAIS DA EDUCAÇÃO,GT07 - Educação de Crianças de 0 a 6 anos,40,2017-2021,http://anais.anped.org.br/sites/default/files/arquivos_21_22.
1263,,O BRINCAR LIVRE NO CICLO DE ALFABETIZAÇÃO: UM ESTUDO SOBRE EXPERIÊNCIA DE FORMAÇÃO SENSÍVEL PARA PROFESSORES,GT13 - Educação Fundamental,40,2017-2021,http://anais.anped.org.br/sites/default/files/arquivos_22_22.
1264,,O CENTRO EDUCATIS E A FORMAÇÃO CONTÍNUA DE PROFESSORES EM PORTUGAL,GT08 - Formação de Professores,40,2017-2021,http://anais.anped.org.br/sites/default/files/arquivos_23_22.
1265,,O CICLO DE VIVÊNCIA PROFISSIONAL: APONTAMENTOS DO ESPAÇO-TEMPO DE TRABALHO NO DISTRITO FEDERAL,GT08 - Formação de Professores,40,2017-2021,http://anais.anped.org.br/sites/default/files/arquivos_24_21.
1266,,O CINEMA NA ESCOLA E A INVESTIGAÇÃO DA HISTÓRIA DA FAVELA: PRÁTICA DE LIBERDADE,GT24 - Educação e Arte,40,2017-2021,http://anais.anped.org.br/sites/default/files/arquivos_25_20.
1267,,"O circuito de cinco obras da poesia infantil brasileira: O menino poeta (Henriqueta Lisboa), Ou isto ou aquilo (Cecília Meireles), Pé de pilão (Mário Quintana), A Arca de Noé (Vinicius de Moraes), e É isso ali (José Paulo Paes).","GT10 - Alfabetização, Leitura e Escrita",40,2017-2021,http://anais.anped.org.br/sites/default/files/arquivos_26_20.
1268,,O CONGRESSO PEDAGÓGICO DO PARÁ E SEUS DISCURSOS EDUCACIONAIS,GT02 – História da Educação,40,2017-2021,http://anais.anped.org.br/sites/default/files/arquivos_27_25.
1269,,O CURRICULAR E O CURRÍCULO: ENTRE A POTÊNCIA DA EXPERIÊNCIA E A METAFÍSICA DO OBJETO,GT12 - Currículo,40,2017-2021,http://anais.anped.org.br/sites/default/files/arquivos_28_20.
1270,,O CURRÍCULO NA EDUCAÇÃO INFANTIL INTERPELA AS DATAS COMEMORATIVAS,GT07 - Educação de Crianças de 0 a 6 anos,40,2017-2021,http://anais.anped.org.br/sites/default/files/arquivos_29_20.
1271,,O debate sobre doutrinação e neutralidade em educação,GT17 - Filosofia da Educação,40,2017-2021,http://anais.anped.org.br/sites/default/files/arquivos_30_20.
1272,,O DESAFIO DAS RELAÇÕES DE CONVIVÊNCIA COM JOVENS ESTUDANTES: EXPERIÊNCIAS DE JOVENS DOCENTES INICIANTES NO ENSINO MÉDIO,GT14 - Sociologia da Educação,40,2017-2021,http://anais.anped.org.br/sites/default/files/arquivos_31_20.
1273,,"O DIREITO À EDUCAÇÃO DAS PESSOAS JOVENS E ADULTAS: DA DENÚNCIA AO ANÚNCIO, SOB UMA PERSPECTIVA CRÍTICO-LIBERTADORA.",GT18 - Educação de Pessoas Jovens e Adultas,40,2017-2021,http://anais.anped.org.br/sites/default/files/arquivos_32_20.
1274,,O DIREITO À PARTICIPAÇÃO DAS CRIANÇAS NAS PESQUISAS EM TEMPOS DE PANDEMIA,GT14 - Sociologia da Educação,40,2017-2021,http://anais.anped.org.br/sites/default/files/arquivos_33_20.
1275,,O DISCURSO CINEMATOGRÁFICO ACERCA DE PESSOAS COM TRANSTORNO DO ESPECTRO AUTISTA,GT15 - Educação Especial,40,2017-2021,http://anais.anped.org.br/sites/default/files/arquivos_34_20.
1276,,O Dossiê Paulo Freire,GT02 – História da Educação,40,2017-2021,http://anais.anped.org.br/sites/default/files/arquivos_35_25.
1277,,O ENCONTRO DA CRIANÇA COM A CIDADE: OS ESPAÇOS PÚBLICOS COMO LUGARES DE APRENDIZAGEM,GT07 - Educação de Crianças de 0 a 6 anos,40,2017-2021,http://anais.anped.org.br/sites/default/files/arquivos_36_19.
1278,,O ENSINO DE SOCIOLOGIA: UM OLHAR SOBRE A IMPLANTAÇÃO DA BNCC NO ENSINO MÉDIO EM MEIO A PANDEMIA DE COVID-19 EM RIO BRANCO - ACRE NO ANO DE 2021,GT04 - Didática,40,2017-2021,http://anais.anped.org.br/sites/default/files/arquivos_37_19.
1279,,O ENSINO NA EDUCAÇÃO INTEGRAL: INQUIETAÇÕES PARA A DIDÁTICA,GT04 - Didática,40,2017-2021,http://anais.anped.org.br/sites/default/files/arquivos_38_19.
1280,,"O ENSINO RELIGIOSO NAS ESCOLAS PÚBLICAS MUNICIPAIS DA CIDADE DE SANTARÉM-PARÁ: PRÁTICAS COTIDIANAS DOS AGENTES SOCIAIS DO SETOR DE ENSINO RELIGIOSO ESCOLAR (SERE), ENTRE 2003 E 2015",GT02 – História da Educação,40,2017-2021,http://anais.anped.org.br/sites/default/files/arquivos_39_24.
1281,,O ESPAÇO EDUCATIVO DA ESCOLA DA PONTE: A PRODUÇÃO DE SABERES NO COTIDIANO ESCOLAR COMO PRÁTICA DA LIBERDADE,GT13 - Educação Fundamental,40,2017-2021,http://anais.anped.org.br/sites/default/files/arquivos_40_19.
1282,,O ESPORTE EDUCACIONAL COMO DIREITO SOCIAL NO PROGRAMA SEGUNDO TEMPO,GT05 - Estado e Política Educacional,40,2017-2021,http://anais.anped.org.br/sites/default/files/arquivos_41_19.
1283,,O ESTADO DA ARTE SOBRE A FORMAÇÃO DE PROFESSORES NO PROGRAMA ALFABETIZAÇÃO NA IDADE CERTA,GT08 - Formação de Professores,40,2017-2021,http://anais.anped.org.br/sites/default/files/arquivos_42_19.
1284,,O ESTADO DO CONHECIMENTO SOBRE O TEMA CIDADE EDUCADORA: AS PRODUÇÕES ACADÊMICAS DOS PROGRAMAS DE PÓS-GRADUAÇÃO NO BRASIL NO PERÍODO DE 2005 A 2019,GT12 - Currículo,40,2017-2021,http://anais.anped.org.br/sites/default/files/arquivos_43_19.
1285,,O FINANCIAMENTO DOS PROGRAMAS UNIVERSAIS DO GOVERNO FEDERAL À EDUCAÇÃO BÁSICA ENTRE 2003 E 2020: AVANÇOS E DESAFIOS,GT05 - Estado e Política Educacional,40,2017-2021,http://anais.anped.org.br/sites/default/files/arquivos_44_19.
1286,,O flanar ubíquo como dispositivo de pesquisa-formação na cibercultura,GT16 - Educação e Comunicação,40,2017-2021,http://anais.anped.org.br/sites/default/files/arquivos_45_19.
1287,,O IMPACTO DO SUPERÁVIT PRIMÁRIO NO FINANCIAMENTO FEDERAL DA EDUCAÇÃO BÁSICA NO PAÍS: 1999-2014:,GT05 - Estado e Política Educacional,40,2017-2021,http://anais.anped.org.br/sites/default/files/arquivos_46_19.
1288,,O INTELECTUAL DA/NA HISTÓRIA DA EDUCAÇÃO INFANTIL,GT07 - Educação de Crianças de 0 a 6 anos,40,2017-2021,http://anais.anped.org.br/sites/default/files/arquivos_47_19.
1289,,O JORNAL ESCOLAR COMO PERCURSO FORMATIVO PARA O DESENVOLVIMENTO DE DISPOSIÇÕES NA PROFISSÃO DOCENTE,GT08 - Formação de Professores,40,2017-2021,http://anais.anped.org.br/sites/default/files/arquivos_48_19.
1290,,O Legado de Paulo Freire e a Ecologia de Saberes na Educação de Jovens e Adultos,GT18 - Educação de Pessoas Jovens e Adultas,40,2017-2021,http://anais.anped.org.br/sites/default/files/arquivos_49_19.
1291,,JUVENTUDES E CONSUMO: O QUE DIZEM ESTUDANTES DA EJA?,GT22 - Educação Ambiental,40,2017-2021,http://anais.anped.org.br/sites/default/files/arquivos_0_21.
1292,,Juventudes negras e brancas e suas identidades no espaço escolar,GT21 - Educação e Relações Étnico-Raciais,40,2017-2021,http://anais.anped.org.br/sites/default/files/arquivos_1_22.
1293,,JUVENTUDE(S) QUE OUSA(M) LUTAR: O Movimento Estudantil Secundarista e o Processo de Consciência Política,"GT03 - Movimentos sociais, sujeitos e processos educativos",40,2017-2021,http://anais.anped.org.br/sites/default/files/arquivos_2_21.
1294,,LEI E VIDA PÚBLICA SOB A PERSPECTIVA DE TOMÁS DE AQUINO: REFLEXÕES SOB A LENTE DA HISTÓRIA DA EDUCAÇÃO,GT02 – História da Educação,40,2017-2021,http://anais.anped.org.br/sites/default/files/arquivos_3_28.
1295,,"LEITURA E ESCUTA: A EXPERIÊNCIA DA ""PALAVRAMUNDO"" EM BIBLIOTECAS COMUNITÁRIAS","GT10 - Alfabetização, Leitura e Escrita",40,2017-2021,http://anais.anped.org.br/sites/default/files/arquivos_4_21.
1296,,LEITURA NAS REDES: o que dizem as pesquisas Stricto Sensu sobre as práticas de leituras a partir da rede social Skoob,GT16 - Educação e Comunicação,40,2017-2021,http://anais.anped.org.br/sites/default/files/arquivos_5_21.
1297,,"LETRAMENTO POLÍTICO COMO (RE)CONHECIMENTO DE PRODUÇÃO DE CONHECIMENTOS: NARRATIVAS DE LENIRA MARIA DE CARVALHO, UMA MULHER NEGRA, TRABALHADORA DOMÉSTICA",GT21 - Educação e Relações Étnico-Raciais,40,2017-2021,http://anais.anped.org.br/sites/default/files/arquivos_6_21.
1298,,LETRAMENTO RELIGIOSO DE DEVOTOS EM CARTAS PARA O BOM JESUS DA LAPA,"GT10 - Alfabetização, Leitura e Escrita",40,2017-2021,http://anais.anped.org.br/sites/default/files/arquivos_7_21.
1299,,LETRAMENTOS ACADÊMICOS: CONFLUÊNCIAS TEÓRICAS E DIDÁTICAS,"GT10 - Alfabetização, Leitura e Escrita",40,2017-2021,http://anais.anped.org.br/sites/default/files/arquivos_8_21.
1300,,LETRAMENTOS IMPLICADOS: PARA LER E ESCREVER “CARTAS DA AMAZÔNIA PARA O MUNDO”,"GT10 - Alfabetização, Leitura e Escrita",40,2017-2021,http://anais.anped.org.br/sites/default/files/arquivos_9_21.
1301,,LICENCIATURAS EM QUESTÃO NA EXPANSÃO DO ENSINO SUPERIOR NO BRASIL,GT11 - Política da Educação Superior,40,2017-2021,http://anais.anped.org.br/sites/default/files/arquivos_10_21.
1302,,LINHAS COSTUMEIRAS E LINHAS DE ERRÂNCIA: QUANDO A NEGRITUDE DOS BEBÊS INVADE A CRECHE,GT07 - Educação de Crianças de 0 a 6 anos,40,2017-2021,http://anais.anped.org.br/sites/default/files/arquivos_11_21.
1303,,LITERATURA AFRO-BRASILEIRA NA ESCOLA: PERCEPÇÕES DE DOCENTES E DISCENTES DE UMA ESCOLA PRIVADA DE IMPERATRIZ-MA,GT21 - Educação e Relações Étnico-Raciais,40,2017-2021,http://anais.anped.org.br/sites/default/files/arquivos_12_21.
1304,,LITERATURA DE AUTORAS NEGRAS E CURRÍCULO: É POSSÍVEL DIZER TUDO?,GT21 - Educação e Relações Étnico-Raciais,40,2017-2021,http://anais.anped.org.br/sites/default/files/arquivos_13_21.
1305,,LITERATURA INDÍGENA: MOVIMENTO PARA DEMARCAÇÃO DO TERRITÓRIO SIMBÓLICO,"GT10 - Alfabetização, Leitura e Escrita",40,2017-2021,http://anais.anped.org.br/sites/default/files/arquivos_14_21.
1306,,LITERATURA INFANTIL DIGITAL: EXPERIÊNCIAS DE LEITURA E AUTORIA NA ESCOLA,GT07 - Educação de Crianças de 0 a 6 anos,40,2017-2021,http://anais.anped.org.br/sites/default/files/arquivos_15_21.
1307,,LIVRO DIDÁTICO: OS USOS E CONSTRUÇÕES CURRICULARES,GT12 - Currículo,40,2017-2021,http://anais.anped.org.br/sites/default/files/arquivos_16_21.
1308,,Los saberes de una comunidad indigéna en Amazonas Colombia:Una lectura desde el pensamiento de Paulo Freire,GT06 - Educação Popular,40,2017-2021,http://anais.anped.org.br/sites/default/files/arquivos_17_21.
1309,,LOUVOR COMO PRÁTICAS DE LETRAMENTO EM UM GRUPO DE O ESTUDOS BÍBLICOS PENTECOSTAL,"GT10 - Alfabetização, Leitura e Escrita",40,2017-2021,http://anais.anped.org.br/sites/default/files/arquivos_18_21.
1310,,MANIFESTAÇÕES POLÍTICAS PELO OLHAR DAS CRIANÇAS,"GT03 - Movimentos sociais, sujeitos e processos educativos",40,2017-2021,http://anais.anped.org.br/sites/default/files/arquivos_19_21.
1311,,MANIFESTA: NOTAS PARA UMA EDUCAÇÃO SEM JUÍZO,"GT23 - Gênero, Sexualidade e Educação",40,2017-2021,http://anais.anped.org.br/sites/default/files/arquivos_20_21.
1312,,MAPEAMENTO DA EXPERIÊNCIA ESTÉTICA E EDUCAÇÃO AMBIENTAL NA FORMAÇÃO DE PROFESSORES,GT22 - Educação Ambiental,40,2017-2021,http://anais.anped.org.br/sites/default/files/arquivos_21_21.
1313,,MASCULINIDADES DOCENTES NA EDUCAÇÃO INFANTIL: ANÁLISE DE DISCURSOS JURÍDICOS E MIDIÁTICOS EM TEMPOS ULTRACONSERVADORES,"GT23 - Gênero, Sexualidade e Educação",40,2017-2021,http://anais.anped.org.br/sites/default/files/arquivos_22_21.
1314,,MASCULINIDADES NEGRAS: O QUE DIZEM AS PESQUISAS APRESENTADAS NOS ENCONTROS DA ANPED (2012 -2019),"GT23 - Gênero, Sexualidade e Educação",40,2017-2021,http://anais.anped.org.br/sites/default/files/arquivos_23_21.
1315,,MATERNIDADES LÉSBICAS E PRÁTICAS DE [RES]EXISTÊNCIAS NA EDUCAÇÃO ESCOLAR: AS LUTAS SÃO ATUALIZADAS NO PRESENTE,"GT23 - Gênero, Sexualidade e Educação",40,2017-2021,http://anais.anped.org.br/sites/default/files/arquivos_24_20.
1316,,MEDIAÇÕES PEDAGÓGICAS NO TERRITÓRIO DE EMPODERAMENTO POPULAR: UM COLETIVO DE MULHERES EM FLORAÇÃO,"GT03 - Movimentos sociais, sujeitos e processos educativos",40,2017-2021,http://anais.anped.org.br/sites/default/files/arquivos_25_19.
1317,,MEMÓRIA DA ESCRAVIDÃO E ENSINO DE HISTÓRIA LOCAL: práticas docentes com relação à presença da população negra.,GT21 - Educação e Relações Étnico-Raciais,40,2017-2021,http://anais.anped.org.br/sites/default/files/arquivos_26_19.
1318,,MEMÓRIA DE INTERDIÇÕES AO DIREITO À EDUCAÇÃO: NARRATIVA DE DONA MALVINA DO SÍTIO SANTA RITA – RJ,GT18 - Educação de Pessoas Jovens e Adultas,40,2017-2021,http://anais.anped.org.br/sites/default/files/arquivos_27_19.
1319,,Memórias da atuação educativa da indígena potiguara Maria Helena Gomes (1994-2009),GT02 – História da Educação,40,2017-2021,http://anais.anped.org.br/sites/default/files/arquivos_28_21.
1320,,MEMÓRIAS DE CORRESPONDÊNCIAS: OS SUJEITOS E A CULTURA MATERIAL ESCOLAR DAS AULAS PÚBLICAS DE CAXIAS DO SUL/ RS (1890 – 1930),GT02 – História da Educação,40,2017-2021,http://anais.anped.org.br/sites/default/files/arquivos_29_25.
1321,,"MEMÓRIAS DE INFÂNCIA DE MULHERES: APRENDIZAGENS DE PERFORMANCES DE GÊNERO, CORPOS EDUCADOS E VIOLADOS","GT23 - Gênero, Sexualidade e Educação",40,2017-2021,http://anais.anped.org.br/sites/default/files/arquivos_30_19.
1322,,Meritocracia para quem? Desigualdades socioeconômicas no acesso ao ensino superior público e privado,GT14 - Sociologia da Educação,40,2017-2021,http://anais.anped.org.br/sites/default/files/arquivos_31_19.
1323,,Metamorfoses da política de formação profissional continuada de trabalhadores(as) no Brasil (2010-2020),GT09 - Trabalho e Educação,40,2017-2021,http://anais.anped.org.br/sites/default/files/arquivos_32_19.
1324,,METODOLOGIAS ATIVAS NO ENSINO BÁSICO: DA PRÁTICA À REFLEXÃO SOBRE A PRÁTICA,GT04 - Didática,40,2017-2021,http://anais.anped.org.br/sites/default/files/arquivos_33_19.
1325,,METODOLOGIAS INDÍGENAS E O CAMPO DOS ESTUDOS CURRICULARES EM DIÁLOGO,GT12 - Currículo,40,2017-2021,http://anais.anped.org.br/sites/default/files/arquivos_34_19.
1326,,"“MEU DEUS, O QUE EU VOU FAZER COM ESSA CRIANÇA?”: EXPERIÊNCIAS DE PROFESSORAS DA EDUCAÇÃO INFANTIL SOBRE A INCLUSÃO ESCOLAR DE CRIANÇAS COM AUTISMO",GT15 - Educação Especial,40,2017-2021,http://anais.anped.org.br/sites/default/files/arquivos_35_19.
1327,,MODELO DE PROFESSOR PERFORMATIVO: A BNC DE FORMAÇÃO CONTINUADA,GT04 - Didática,40,2017-2021,http://anais.anped.org.br/sites/default/files/arquivos_36_18.
1328,,Movimentos associativistas e sindicais docentes maranhenses em tempos da transição democrática brasileira (1985-1986),"GT03 - Movimentos sociais, sujeitos e processos educativos",40,2017-2021,http://anais.anped.org.br/sites/default/files/arquivos_37_18.
1329,,MOVIMENTOS DE LEITURA E ESCRITA NO TRABALHO COM PROJETOS DE LETRAMENTO: O CASO DO MIEGI,"GT10 - Alfabetização, Leitura e Escrita",40,2017-2021,http://anais.anped.org.br/sites/default/files/arquivos_38_18.
1330,,MUITO ALÉM DO “PUNTO CERO”: PROVOCAÇÃO PARA UMA ESCRITA ACADÊMICA NEGRA SEM GAMBIARRAS OU DISTANCIAMENTOS EPISTEMOLÓGICOS,GT21 - Educação e Relações Étnico-Raciais,40,2017-2021,http://anais.anped.org.br/sites/default/files/arquivos_39_18.
1331,,"MULHERES MANAUARAS, A EDUCAÇÃO DE CRIANÇAS PEQUENININHAS, DIREITO À CRECHE E COLONIALIDADE",GT07 - Educação de Crianças de 0 a 6 anos,40,2017-2021,http://anais.anped.org.br/sites/default/files/arquivos_40_18.
1332,,MULHERES NEGRAS E SUAS TRAJETÓRIA NO ENSINO SUPERIOR: BREVES NOTAS DO QUE DIZEM OS ESTUDOS,GT21 - Educação e Relações Étnico-Raciais,40,2017-2021,http://anais.anped.org.br/sites/default/files/arquivos_41_18.
1333,,"MULHERES NEGRAS QUILOMBOLAS: UM ESTUDO DE CASO SOBRE AGÊNCIA FEMININA NA DINÂMICA DA GERAÇÃO FAMILIAR, BARRINHA, BOM JESUS DA LAPA-BAHIA",GT21 - Educação e Relações Étnico-Raciais,40,2017-2021,http://anais.anped.org.br/sites/default/files/arquivos_42_18.
1334,,MUSICOGRAFIA BRAILLE: IMAGINAÇÃO E CRIAÇÃO DA PESSOA COM DEFICIÊNCIA VISUAL EM MÚSICA,GT20 - Psicologia da Educação,40,2017-2021,http://anais.anped.org.br/sites/default/files/arquivos_43_18.
1335,,"NA CONTRAMÃO DA BNCC: DO EMPAREDAMENTO AO LIVRE BRINCAR, EM BUSCA DE PEDAGOGIAS BIOFÍLICAS",GT22 - Educação Ambiental,40,2017-2021,http://anais.anped.org.br/sites/default/files/arquivos_44_18.
