,Autor(es),Título,GT,Evento,Ano,Link do Arquivo
368,Camila Alberto Vicente de Oliveira,Balanço das pesquisas sobre o docente do ensino superior: estado do conhecimento nos Anais da ANPEd entre 2002 – 2015,GT04 - Didática,38,2017-2021,http://anais.anped.org.br/sites/default/files/arquivos/trabalho_38anped_2017_GT04_997.pdf
369,Luciana Aparecida Godinho Novaes,O estado da questão sobre as práticas pedagógicas nas escolas normais brasileiras do século XX,GT04 - Didática,38,2017-2021,http://anais.anped.org.br/sites/default/files/arquivos/poster_38anped_2017_GT04_749.pdf
370,"Rosana Aparecida Ferreira Pontes, Selma Garrido Pimenta",A pesquisa na formação inicial de professores: uma perspectiva didática inédita e viável,GT04 - Didática,38,2017-2021,http://anais.anped.org.br/sites/default/files/arquivos/poster_38anped_2017_GT04_229.pdf
371,Orlando Fernández Aquino,Influências da pergunta na formação de conceitos científicos: um ensaio de interpretação,GT04 - Didática,38,2017-2021,http://anais.anped.org.br/sites/default/files/arquivos/trabalho_38anped_2017_GT04_92.pdf
372,"Caroline Jaques Cubas, Karen Christine Rechia",O que faz uma aula? Didática e formação docente inicial,GT04 - Didática,38,2017-2021,http://anais.anped.org.br/sites/default/files/arquivos/trabalho_38anped_2017_GT04_737.pdf
373,"Waleska Dayse Dias de Sousa, Andréa Maturano Longarezi",A Produção De Instrumentos Como Mediadores Da Organização Didática E Da Formação E Desenvolvimento Didático Do Professor,GT04 - Didática,38,2017-2021,http://anais.anped.org.br/sites/default/files/arquivos/trabalho_38anped_2017_GT04_34.pdf
374,Silas Borges Monteiro,Da Espectatura À Didática: Desconstrução Da Experiência Fílmica No Ensino Superior,GT04 - Didática,38,2017-2021,http://anais.anped.org.br/sites/default/files/arquivos/trabalho_38anped_2017_GT04_328.pdf
375,"Silvana Soares de Araujo Mesquita, Isabel Lelis",O Exercício Da Docência No Ensino Médio: A Didática Marcada Pelas Dimensões Relacionais E Motivacionais Na Prática Docente.,GT04 - Didática,38,2017-2021,http://anais.anped.org.br/sites/default/files/arquivos/trabalho_38anped_2017_GT04_262.pdf
376,Adriana Fernandes Coimbra Marigo,Tertúlias Dialógicas Na Mediação Didática Com O Conhecimento,GT04 - Didática,38,2017-2021,http://anais.anped.org.br/sites/default/files/arquivos/trabalho_38anped_2017_GT04_1310.pdf
377,"Isabel Magda Said Pierre Carneiro, Maria Marina Dias Cavalcante, Fátima Maria Nobre Lopes",A necessidade de uma posição teleológica voltada para a formação didático-pedagógica de rofessores bacharéis e tecnológos,GT04 - Didática,38,2017-2021,http://anais.anped.org.br/sites/default/files/arquivos/trabalho_38anped_2017_GT04_809.pdf
378,"Cláudia Starling Bosco, Marilza de Oliveira Santos","Resistências E Transformações No Ato De Planejar Na Relação Ensino, Pesquisa E Extensão: Análise De Narrativasde Recém-Doutores Ingressos No Magistério Superior",GT04 - Didática,38,2017-2021,http://anais.anped.org.br/sites/default/files/arquivos/trabalho_38anped_2017_GT04_1164.pdf
379,,EDUCAÇÃO SEXUAL EM CAMPO GRANDE NOS ANOS 1930,GT02 – História da Educação,39,2017-2021,http://anais.anped.org.br/sites/default/files/5251-texto_proposta_completo.pdf
380,,Reflexões sobre Alguns Impasses na Formação Inicial de Professoras(es) para a Educação Infantil no Curso de Pedagogia,GT07 - Educação de Crianças de 0 a 6 anos,39,2017-2021,http://anais.anped.org.br/sites/default/files/gt07_trabalho_encomendado_formatado_39_rn_-_1_maria_carmem_silveira_barbosa.pdf
381,,Esse in anima: formação docente em deslocamento,GT07 - Educação de Crianças de 0 a 6 anos,39,2017-2021,http://anais.anped.org.br/sites/default/files/gt07_trabalho_encomendado_formatado_39_rn_-_2_luciana_esmeralda_ostetto.pdf
382,,"Educação Infantil e Formação de Professores: relações e contradições entre trabalho, formação e Base Nacional Comum Curricular (BNCC)",GT07 - Educação de Crianças de 0 a 6 anos,39,2017-2021,http://anais.anped.org.br/sites/default/files/gt07_trabalho_encomendado_formatado_39_rn_-_3_ivone_garcia_barbosa.pdf
383,,Crises do Capital e o recrudescimento do conservadorismo à luz do materialismo histórico,GT09 - Trabalho e Educação,39,2017-2021,http://anais.anped.org.br/sites/default/files/gt09_trabalho_encomendado_formatado_39rn.pdf
384,,“ENTROU... E AGORA?” UMA REFLEXÃO SOBRE ATENDIMENTO EDUCACIONAL ESPECIALIZADO (AEE) PARA ESTUDANTES COM DEFICIÊNCIA COMO DISPOSITIVO DE PERMANÊNCIA EM UNIVERSIDADES PÚBLICAS FEDERAIS,,39,2017-2021,http://anais.anped.org.br/sites/default/files/arquivos_0_0.
385,,“TEMAS ATUAIS PARA A EDUCAÇÃO INFANTIL”,,39,2017-2021,http://anais.anped.org.br/sites/default/files/arquivos_1_13.
386,,A AGENDA EDUCACIONAL DO BANCO MUNDIAL E DO SISTEMA ONU PARA PESSOAS COM DEFICIÊNCIA,,39,2017-2021,http://anais.anped.org.br/sites/default/files/arquivos_2_12.
387,,"A BNCC E AS TENSÕES NA GESTÃO, AVALIAÇÃO E CURRÍCULO ESCOLARES",,39,2017-2021,http://anais.anped.org.br/sites/default/files/arquivos_3_6.
388,,"A FORMAÇÃO DE PROFESSORES SOB TRÊS PERSPECTIVAS: O ESTÁGIO, A RESIDÊNCIA DOCENTE E A FUNÇÃO DA COORDENAÇÃO PEDAGÓGICA",,39,2017-2021,http://anais.anped.org.br/sites/default/files/arquivos_4_12.
389,,A FORMAÇÃO DO CORPO PROFESSOR PARA O RECONHECIMENTO DAS relações ETNICO-RACIAIS NA EDUCAÇÃO iNTERCULTURAL,,39,2017-2021,http://anais.anped.org.br/sites/default/files/arquivos_5_12.
390,,A PESQUISA QUALITATIVA EM EDUCAÇÃO POR MEIO DO MÉTODO DOCUMENTÁRIO,,39,2017-2021,http://anais.anped.org.br/sites/default/files/arquivos_6_1.
391,,A REGULAÇÃO E A REGULAMENTAÇÃO DA RELAÇÃO PÚBLICO-PRIVADO NA EDUCAÇÃO: O PAPEL DAS ENTIDADES DO TERCEIRO SETOR MERCANTIL,,39,2017-2021,http://anais.anped.org.br/sites/default/files/arquivos_7_3.
392,,A RELEVÂNCIA DAS PESQUISAS COM OS COTIDIANOS NOS ENFRENTAMENTOS DA CRISE ATUAL DE DEMOCRACIA,,39,2017-2021,http://anais.anped.org.br/sites/default/files/arquivos_8_9.
393,,ACCOUNTABILITY EM EDUCAÇÃO NO CONTEXTO DE POLÍTICAS DE REGULAÇÃO POR RESULTADOS: CONFIGURAÇÃO E EXPERIÊNCIAS EM ESTADOS BRASILEIROS,,39,2017-2021,http://anais.anped.org.br/sites/default/files/arquivos_9_1.
394,,ANFOPE: HISTÓRIA E LUTA PELA FORMAÇÃO E VALORIZAÇÃO DOS PROFISSIONAIS DA EDUCAÇÃO,,39,2017-2021,http://anais.anped.org.br/sites/default/files/arquivos_10_8.
395,,AS CONTRIBUIÇÕES DOS ESCRITOS DE ANTONIO GRAMSCI PARA A ANÁLISE DA EDUCAÇÃO ESPECIAL NO BRASIL,,39,2017-2021,http://anais.anped.org.br/sites/default/files/arquivos_11_2.
396,,AS TENDÊNCIAS DO ENSINO SUPERIOR: EXPANSÃO E INTERNACIONALIZAÇÃO,,39,2017-2021,http://anais.anped.org.br/sites/default/files/arquivos_12_4.
397,,BEBÊS E PROFESSORAS EM CONTEXTOS COLETIVOS DE CUIDADO E EDUCAÇÃO,,39,2017-2021,http://anais.anped.org.br/sites/default/files/arquivos_13_6.
398,,DESAFIOS DA FORMAÇÃO DE PROFESSORES NA CONJUNTURA ATUAL: DO DESMONTE DAS POLÍTICAS ÀS PERSPECTIVAS DE RESISTÊNCIA,,39,2017-2021,http://anais.anped.org.br/sites/default/files/arquivos_14_12.
399,,DO GOVERNO DAS DIFERENÇAS AOS CORPOS INGOVERNÁVEIS: POTÊNCIAS DE VIDA NA EDUCAÇÃO,,39,2017-2021,http://anais.anped.org.br/sites/default/files/arquivos_15_12.
400,,EDUCAÇÃO DAS RELAÇÕES ÉTNICO-RACIAIS E EDUCAÇÃO ESCOLAR QUILOMBOLA:  DESAFIOS NA FORMAÇÃO DOCENTE,,39,2017-2021,http://anais.anped.org.br/sites/default/files/arquivos_16_12.
401,,"EDUCAÇÃO ESPECIAL, PSICANÁLISE E EXPERIÊNCIA DEMOCRÁTICA",,39,2017-2021,http://anais.anped.org.br/sites/default/files/arquivos_17_12.
402,,"ESTUDOS SOBRE O CONHECIMENTO ESCOLAR NO BRASIL: TENDÊNCIAS, PERSPECTIVAS E CONTROVÉRSIAS",,39,2017-2021,http://anais.anped.org.br/sites/default/files/arquivos_18_7.
403,,"EXPANSÃO DO ENSINO SUPERIOR, PRODUÇÃO E EFEITOS DE DESIGUALDADES SOCIAIS",,39,2017-2021,http://anais.anped.org.br/sites/default/files/arquivos_19_5.
404,,EXPERIÊNCIA E FORMAÇÃO DOCENTE NA EDUCAÇÃO BÁSICA DA BAHIA ,,39,2017-2021,http://anais.anped.org.br/sites/default/files/arquivos_20_0.
405,,"FORMAÇÃO DE PROFESSORES:  UTOPIAS, ESPERANÇA E SONHO POSSÍVEL NO EXERCÍCIO DA DEMOCRACIA",,39,2017-2021,http://anais.anped.org.br/sites/default/files/arquivos_21_1.
406,,GRUPOS/REDES DE PESQUISA: LOCI ESPAÇO-TEMPORAIS DE FORMAÇÃO E DE PRODUÇÃO DO CONHECIMENTO,,39,2017-2021,http://anais.anped.org.br/sites/default/files/arquivos_22_5.
407,,"INFÂNCIAS, TRABALHO E ESCOLA",,39,2017-2021,http://anais.anped.org.br/sites/default/files/arquivos_23_4.
408,,LAICIDADE DO ESTADO E EDUCAÇÃO SOB ATAQUE: INTERSECÇÕES E RESISTÊNCIAS,,39,2017-2021,http://anais.anped.org.br/sites/default/files/arquivos_24_8.
409,,NEOLIBERALISMO E NEOCONSERVADORISMO NA EDUCAÇÃO BRASILEIRA: UMA ANÁLISE A PARTIR DE POLÍTICAS EDUCACIONAIS,,39,2017-2021,http://anais.anped.org.br/sites/default/files/arquivos_25_8.
410,,O RETORNO DA COMPARAÇÃO ÀS INVESTIGAÇÕES EM EDUCAÇÃO: uma operação de equiparação do outro ao nosso ,,39,2017-2021,http://anais.anped.org.br/sites/default/files/arquivos_26_8.
411,,"PARADIGMAS, POLÍTICAS PÚBLICAS E CURRÍCULO NA EJA",,39,2017-2021,http://anais.anped.org.br/sites/default/files/arquivos_27_4.
412,,"PAULO FREIRE, MAIS DO QUE NUNCA",,39,2017-2021,http://anais.anped.org.br/sites/default/files/arquivos_28_8.
413,,PLANEJAMENTO EDUCACIONAL EM CONTEXTOS LOCAIS: DO PLANO NACIONAL AOS PLANOS MUNICIPAIS DE EDUCAÇÃO,,39,2017-2021,http://anais.anped.org.br/sites/default/files/arquivos_29_8.
414,,POLÍTICA E GESTÃO DA EDUCAÇÃO BÁSICA: DIRETRIZES OFICIAIS E SEUS DESDOBRAMENTOS EM ESCOLAS,,39,2017-2021,http://anais.anped.org.br/sites/default/files/arquivos_30_0.
415,,POLÍTICA EDUCACIONAL NO ESTADO DE SÃO PAULO – 24 ANOS DE GOVERNOS DO PSDB,,39,2017-2021,http://anais.anped.org.br/sites/default/files/arquivos_31_10.
416,,"POLÍTICAS, GESTÃO E DIREITO À EDUCAÇÃO SUPERIOR: NOVOS MODOS DE REGULAÇÃO E TENDÊNCIAS EM CONSTRUÇÃO",,39,2017-2021,http://anais.anped.org.br/sites/default/files/arquivos_32_3.
417,,PRIVATIZAÇÃO E FINANCEIRIZAÇÃO DA EDUCAÇÃO,,39,2017-2021,http://anais.anped.org.br/sites/default/files/arquivos_33_8.
418,,SOBRE CONSTITUIR-SE DOCENTE DA EDUCAÇÃO INFANTIL: POTÊNCIAS EM EXPERIÊNCIAS DE FORMAÇÃO,,39,2017-2021,http://anais.anped.org.br/sites/default/files/arquivos_34_6.
419,,TENDÊNCIAS DA PESQUISA SOBRE A FORMAÇÃO DE PROFESSORES NO BRASIL: O ESTADO DO CONHECIMENTO EM QUESTÃO,,39,2017-2021,http://anais.anped.org.br/sites/default/files/arquivos_35_1.
420,,"Currículo, em meio a ataques, lutas e resistências: produções acadêmicas da região Nordeste no GT 12 da ANPED ¬¬",GT12 - Currículo,39,2017-2021,http://anais.anped.org.br/sites/default/files/arquivos_0_11.
421,,"O NOVO ENSINO MÉDIO PARAENSE DA LEI N. 13.415/2017: DISSENSOS, DISPUTAS E RESISTÊNCIAS",GT05 - Estado e Política Educacional,39,2017-2021,http://anais.anped.org.br/sites/default/files/arquivos_1_11.
422,,CONTEXTOS DA PRECARIZAÇÃO DOCENTE NA EDUCAÇÃO BRASILEIRA,GT05 - Estado e Política Educacional,39,2017-2021,http://anais.anped.org.br/sites/default/files/arquivos_2_11.
423,,FORMAÇÃO DE PROFESSORES PARA ALFABETIZAR-LETRANDO: QUAIS AS CONTRIBUIÇÕES DO PNAIC?,GT08 - Formação de Professores,39,2017-2021,http://anais.anped.org.br/sites/default/files/arquivos_3_11.
424,,META – 19 DO PLANO NACIONAL DE EDUCAÇÃO (2014-2024): DOIS MODELOS DE GESTÃO CONTRADITÓRIOS,GT05 - Estado e Política Educacional,39,2017-2021,http://anais.anped.org.br/sites/default/files/arquivos_4_11.
425,,DESAFIOS E POTENCIALIDADES DA CONSTRUÇÃO DE TRABALHOS DE CONCLUSÃO DE CURSO NA ALTERNÂNCIA DA LICENCIATURA EM EDUCAÇÃO DO CAMPO DA UFTM,"GT03 - Movimentos sociais, sujeitos e processos educativos",39,2017-2021,http://anais.anped.org.br/sites/default/files/arquivos_5_11.
426,,PRÁTICAS DE LEITURA NOS ANOS FINAIS DO ENSINO FUNDAMENTAL,GT14 - Sociologia da Educação,39,2017-2021,http://anais.anped.org.br/sites/default/files/arquivos_6_11.
427,,MERCANTILIZAÇÃO DA FORMAÇÃO DE PEDAGOGOS NO BRASIL,GT08 - Formação de Professores,39,2017-2021,http://anais.anped.org.br/sites/default/files/arquivos_7_11.
428,,DO PROJETO SOCIAL AO ENSINO SUPERIOR: SUPORTES E TRANSIÇÕES DE JOVENS PROFISSIONAIS INSERIDOS NO SETOR CULTURAL,"GT03 - Movimentos sociais, sujeitos e processos educativos",39,2017-2021,http://anais.anped.org.br/sites/default/files/arquivos_8_11.
429,,Nas paredes da escola: histórias de estudantes gays inscritas de violências e subjetividades,"GT23 - Gênero, Sexualidade e Educação",39,2017-2021,http://anais.anped.org.br/sites/default/files/arquivos_9_11.
430,,"“AQUI NÃO É AULA, NÃO É ESCOLA!” UM ESTUDO SOBRE AS RELAÇÕES ENTRE EDUCAÇÃO E PROTEÇÃO EM UM PROJETO SOCIAL PÚBLICO",GT14 - Sociologia da Educação,39,2017-2021,http://anais.anped.org.br/sites/default/files/arquivos_10_11.
431,,O FECHAMENTO DA ESCOLA DO ASSENTAMENTO FORTALEZA(SE): PROFESSORA CADÊ A MINHA GOIABEIRA?,"GT03 - Movimentos sociais, sujeitos e processos educativos",39,2017-2021,http://anais.anped.org.br/sites/default/files/arquivos_11_11.
432,,"RELAÇÃO ENTRE JUVENTUDE, ESCOLA E POBREZA","GT03 - Movimentos sociais, sujeitos e processos educativos",39,2017-2021,http://anais.anped.org.br/sites/default/files/arquivos_12_11.
433,,NA DANÇA DOS CORPOS AS IDENTIDADES ÉTNICO-RACIAIS SE IDENTIFICAM NA EDUCAÇÃO FÍSICA ESCOLAR,GT21 - Educação e Relações Étnico-Raciais,39,2017-2021,http://anais.anped.org.br/sites/default/files/arquivos_13_11.
434,,O PROCESSO DE IMPLANTAÇÃO DAS POLÍTICAS CURRICULARES DA EDUCAÇÃO PROFISSIONAL E O TRABALHO DOCENTE,GT12 - Currículo,39,2017-2021,http://anais.anped.org.br/sites/default/files/arquivos_14_11.
435,,O currículo da formação superior em Educação Física entre as tramas da racionalidade neoliberal,GT12 - Currículo,39,2017-2021,http://anais.anped.org.br/sites/default/files/arquivos_15_11.
436,,O PAPEL DA EDUCAÇÃO NA FORMAÇÃO DE UM ESTADO BRASILEIRO DEMOCRÁTICO: DISPUTA PELA HEGEMONIA DO PROJETO NACIONAL NOS ENLACES DE ÁLVARO VIEIRA PINTO E PASCHOAL LEMME,GT05 - Estado e Política Educacional,39,2017-2021,http://anais.anped.org.br/sites/default/files/arquivos_16_11.
437,,AS MIGRAÇÕES E AS REDES EDUCATIVAS PARA ‘FAZERPENSAR’ QUESTÕES CURRICULARES E A BNCC,GT12 - Currículo,39,2017-2021,http://anais.anped.org.br/sites/default/files/arquivos_17_11.
438,,Capacidade Estatal de Implementação: programas federais de educação básica e os municípios,GT05 - Estado e Política Educacional,39,2017-2021,http://anais.anped.org.br/sites/default/files/arquivos_18_11.
439,,EROS VOLUSIA BAILARINA E PROFESSORA DE DANÇA: MOMENTOS DE UM LEGADO ARTÍSTICO,GT24 - Educação e Arte,39,2017-2021,http://anais.anped.org.br/sites/default/files/arquivos_19_11.
440,,Corpos em movimento – olhares acerca dos estudos nos/dos/com cotidianos,GT12 - Currículo,39,2017-2021,http://anais.anped.org.br/sites/default/files/arquivos_20_11.
441,,DEZ NOÇÕES SUBSUNÇORAS À IDEOLOGIA DE GÊNERO NO DISCURSO MIDIÁTICO-PEDAGÓGICO: uma autoetnografia,"GT23 - Gênero, Sexualidade e Educação",39,2017-2021,http://anais.anped.org.br/sites/default/files/arquivos_21_11.
442,,"Aspectos da História, Filosofia e Sociologia da Ciência (HFSC) em Estudo de Gênero na Pesquisa em Educação em Ciência e Matemática","GT23 - Gênero, Sexualidade e Educação",39,2017-2021,http://anais.anped.org.br/sites/default/files/arquivos_22_11.
443,,Educação no chão do meu terreiro: Jurema Preta a senhora é rainha!,GT21 - Educação e Relações Étnico-Raciais,39,2017-2021,http://anais.anped.org.br/sites/default/files/arquivos_23_11.
444,,EDUCAÇÃO INTEGRAL NA CONSTRUÇÃO DE UM TERRITÓRIO EDUCADOR,GT05 - Estado e Política Educacional,39,2017-2021,http://anais.anped.org.br/sites/default/files/arquivos_24_10.
445,,O PAPEL DA EDUCAÇÃO NA FORMAÇÃO DE UM ESTADO BRASILEIRO DEMOCRÁTICO: DISPUTA PELA HEGEMONIA DO PROJETO NACIONAL NOS ENLACES DE ÁLVARO VIEIRA PINTO E PASCHOAL LEMME,GT05 - Estado e Política Educacional,39,2017-2021,http://anais.anped.org.br/sites/default/files/4748-texto_proposta_completo.pdf
446,,OS ENTRELUGARES DE UMA ESCOLA MUNICIPAL DE EDUCAÇÃO INFANTIL E ENSINO FUNDAMENTAL: CURRÍCULOS DE RESISTÊNCIA COTIDIANA,GT12 - Currículo,39,2017-2021,http://anais.anped.org.br/sites/default/files/arquivos_0_10.
447,,Os regimes de presença de estudantes adultos no ensino fundamental: uma análise a partir dos históricos escolares,GT18 - Educação de Pessoas Jovens e Adultas,39,2017-2021,http://anais.anped.org.br/sites/default/files/arquivos_1_6.
448,,TEORIA ATOR-REDE E A FORMAÇÃO DO EDUCADOR AMBIENTAL,GT22 - Educação Ambiental,39,2017-2021,http://anais.anped.org.br/sites/default/files/arquivos_2_3.
449,,A escola e o futuro nas vozes de jovens-estudantes do Ensino Médio: contribuições etnográficas à educação,GT14 - Sociologia da Educação,39,2017-2021,http://anais.anped.org.br/sites/default/files/arquivos_3_10.
450,,Juventude e o Programa de Aprendizagem Profissional: Um Estudo na Região Leste Fluminense.,"GT03 - Movimentos sociais, sujeitos e processos educativos",39,2017-2021,http://anais.anped.org.br/sites/default/files/arquivos_4_0.
451,,A obrigatoriedade da pré-escola leva à sua universalização?,GT07 - Educação de Crianças de 0 a 6 anos,39,2017-2021,http://anais.anped.org.br/sites/default/files/arquivos_5_10.
452,,Participação e controle social na gestão financeira de Centros de Educação de Jovens e Adultos no Rio de Janeiro,GT18 - Educação de Pessoas Jovens e Adultas,39,2017-2021,http://anais.anped.org.br/sites/default/files/arquivos_6_10.
453,,CADERNOS DE LIÇÕES: OS DESENHOS DAS PRINCESAS,GT02 – História da Educação,39,2017-2021,http://anais.anped.org.br/sites/default/files/arquivos_7_10.
454,,ENTRE A ACEITAÇÃO E A FUGA: a juventude negra em trânsito nos currículos escolares,GT21 - Educação e Relações Étnico-Raciais,39,2017-2021,http://anais.anped.org.br/sites/default/files/arquivos_8_7.
455,,AS PERCEPÇÕES DE ESTUDANTES DO ENSINO MÉDIO ACERCA DA MILITARIZAÇÃO DA ESCOLA,GT20 - Psicologia da Educação,39,2017-2021,http://anais.anped.org.br/sites/default/files/arquivos_9_4.
456,,A recente expansão para a democratização do ensino superior no Brasil e suas implicações para a assistência estudantil,GT11 - Política da Educação Superior,39,2017-2021,http://anais.anped.org.br/sites/default/files/arquivos_10_0.
457,,MATRIZ CURRICULAR PARA A EDUCAÇÃO DAS RELAÇÕES ÉTNICO-RACIAIS NA EDUCAÇÃO BÁSICA DE FLORIANÓPOLIS: ANÁLISES SOBRE A EDUCAÇÃO INFANTIL,GT21 - Educação e Relações Étnico-Raciais,39,2017-2021,http://anais.anped.org.br/sites/default/files/arquivos_11_4.
458,,A LICENCIATURA EM EDUCAÇÃO DO CAMPO DA UFES E OS DESAFIOS DA PERMANÊNCIA CAMPESINA NO ENSINO SUPERIOR,GT11 - Política da Educação Superior,39,2017-2021,http://anais.anped.org.br/sites/default/files/arquivos_12_10.
459,,RELAÇÕES ESCOLA-FAMÍLIA NA CONSTRUÇÃO DAS IDENTIDADES DE GÊNERO NA EDUCAÇÃO INFANTIL,GT14 - Sociologia da Educação,39,2017-2021,http://anais.anped.org.br/sites/default/files/arquivos_13_10.
460,,A implementação do Turno Único Carioca: compreendendo o papel dos agentes,GT14 - Sociologia da Educação,39,2017-2021,http://anais.anped.org.br/sites/default/files/arquivos_14_10.
461,,A Política Nacional de Educação Popular em Saúde na atual conjuntura do SUS: fragilidades e desafios,GT06 - Educação Popular,39,2017-2021,http://anais.anped.org.br/sites/default/files/arquivos_15_10.
462,,FORMAÇÃO INICIAL NOS JOGOS OLÍMPICOS RIO 2016,GT09 - Trabalho e Educação,39,2017-2021,http://anais.anped.org.br/sites/default/files/arquivos_16_6.
463,,"EDUCAÇÃO INFANTIL, INFÂNCIA E GÊNERO NAS REUNIÕES DA ASSOCIAÇÃO NACIONAL DE PÓS-GRADUAÇÃO E PESQUISA EM EDUCAÇÃO",GT07 - Educação de Crianças de 0 a 6 anos,39,2017-2021,http://anais.anped.org.br/sites/default/files/arquivos_17_10.
464,,"“TIA, QUERO SER NEGRO”: DIFERENÇAS ÉTNICO-RACIAIS NA CRECHE",GT07 - Educação de Crianças de 0 a 6 anos,39,2017-2021,http://anais.anped.org.br/sites/default/files/arquivos_18_10.
465,,Encontro dialógico entre formação inicial e continuada: narrativas pedagógicas como dispositivos de (trans)formação,GT13 - Educação Fundamental,39,2017-2021,http://anais.anped.org.br/sites/default/files/arquivos_19_6.
466,,Enegrecer as universidades: um desafio para a formação de educadores/as do campo?,"GT03 - Movimentos sociais, sujeitos e processos educativos",39,2017-2021,http://anais.anped.org.br/sites/default/files/arquivos_20_1.
467,,Base/Comum/Nacional: A busca pela universalização na BNCC,GT12 - Currículo,39,2017-2021,http://anais.anped.org.br/sites/default/files/arquivos_21_7.
468,,CONCEPÇÕES E PRÁTICAS DIDÁTICAS DE PROFESSORES EM INSERÇÃO PROFISSIONAL,GT04 - Didática,39,2017-2021,http://anais.anped.org.br/sites/default/files/arquivos_22_10.
469,,Educação Ambiental e seus fundamentos epistemológicos: a produção científica do campo,GT22 - Educação Ambiental,39,2017-2021,http://anais.anped.org.br/sites/default/files/arquivos_23_10.
470,,A ATUAÇÃO DA BURGUESIA BRASILEIRA NA REFORMA DO ENSINO MÉDIO,GT05 - Estado e Política Educacional,39,2017-2021,http://anais.anped.org.br/sites/default/files/arquivos_0_8.
471,,O que pensam professores sobre a reprovação e os ciclos,GT14 - Sociologia da Educação,39,2017-2021,http://anais.anped.org.br/sites/default/files/arquivos_1_8.
472,,Carmem Portinho: “Uma engenheira que lutou para vencer: de professora de matemática à chefe de Departamento”,GT02 – História da Educação,39,2017-2021,http://anais.anped.org.br/sites/default/files/arquivos_2_8.
473,,A ORGANIZAÇÃO DO TRABALHO PEDAGÓGICO: O OLHAR DAS DOCENTES FACE À APROPRIAÇÃO DA LEITURA E DA ESCRITA NO BLOCO INICIAL DE ALFABETIZAÇÃO,"GT10 - Alfabetização, Leitura e Escrita",39,2017-2021,http://anais.anped.org.br/sites/default/files/arquivos_3_0.
474,,O PROJETO POLÍTICO PEDAGÓGICO COMO ELEMENTO DA GESTÃO ESCOLAR DEMOCRÁTICA,GT05 - Estado e Política Educacional,39,2017-2021,http://anais.anped.org.br/sites/default/files/arquivos_4_6.
475,,O MAPEAMENTO DAS RELAÇÕES ENTRE MÚSICA E EDUCAÇÃO NO GT-24 DA ANPED: ELEMENTOS PARA ANALISAR A PRODUÇÃO ACADÊMICA ENTRE 2009 - 2017,GT24 - Educação e Arte,39,2017-2021,http://anais.anped.org.br/sites/default/files/arquivos_5_4.
476,,NOTAS SOBRE ATENÇÃO E EDUCAÇÃO,GT17 - Filosofia da Educação,39,2017-2021,http://anais.anped.org.br/sites/default/files/arquivos_6_8.
477,,Experiências e projetos de futuro de jovens em semiliberdade,"GT03 - Movimentos sociais, sujeitos e processos educativos",39,2017-2021,http://anais.anped.org.br/sites/default/files/arquivos_7_0.
478,,Uma discussão sobre a natureza das pesquisas sobre conhecimento profissional do Professor: o caso do Bolema,GT19 - Educação Matemática,39,2017-2021,http://anais.anped.org.br/sites/default/files/arquivos_8_10.
479,,EDUCAÇÃO E DIVERSIDADE CULTURAL: um olhar sobre o cotidiano de uma escola ribeirinha de Ensino Fundamental.,"GT03 - Movimentos sociais, sujeitos e processos educativos",39,2017-2021,http://anais.anped.org.br/sites/default/files/arquivos_9_0.
480,,Heteroidentificação racial em concursos públicos para professores/as na Universidade Federal de Ouro Preto - UFOP,GT21 - Educação e Relações Étnico-Raciais,39,2017-2021,http://anais.anped.org.br/sites/default/files/arquivos_10_1.
481,,Professoras e professores temporários: a precarização do trabalho docente,GT09 - Trabalho e Educação,39,2017-2021,http://anais.anped.org.br/sites/default/files/arquivos_11_10.
482,,OS INSTITUTOS FEDERAIS COMO POLÍTICA EDUCACIONAL: A CONSOLIDAÇÃO DE UM NOVO CONTEXTO EMERGENTE,GT05 - Estado e Política Educacional,39,2017-2021,http://anais.anped.org.br/sites/default/files/arquivos_12_9.
483,,SENTIDOS DO TRABALHO E FORMAÇÃO DOCENTE NOS DOCUMENTOS DO PIBID: CONTRADIÇÕES E POSSIBILIDADES,GT05 - Estado e Política Educacional,39,2017-2021,http://anais.anped.org.br/sites/default/files/arquivos_13_9.
484,,"Infância, Imagem e Tempo: Devir-criança e Educação Infantil",GT07 - Educação de Crianças de 0 a 6 anos,39,2017-2021,http://anais.anped.org.br/sites/default/files/arquivos_14_9.
485,,O DESEMPENHO DOS INSTITUTOS FEDERAIS NA EDUCAÇÃO SUPERIOR,GT11 - Política da Educação Superior,39,2017-2021,http://anais.anped.org.br/sites/default/files/arquivos_15_6.
486,,Práticas de diferenciação pedagógica na rede municipal de São Paulo: possibilidades e limites,GT13 - Educação Fundamental,39,2017-2021,http://anais.anped.org.br/sites/default/files/arquivos_16_9.
487,,A CURA-REZA COMO ATO EDUCATIVO EMANCIPATÓRIO NO MUNICÍPIO DE PENDÊNCIAS/RN: SABERES EM DIÁLOGO,GT06 - Educação Popular,39,2017-2021,http://anais.anped.org.br/sites/default/files/arquivos_17_2.
488,,"INSTITUIÇÕES CONVENIADAS DE EDUCAÇÃO INFANTIL E FORMAÇÃO DE PROFESSORES: INDICADORES DA PRODUÇÃO ACADÊMICA EM CONTEXTO DE ATAQUES, LUTAS E RESISTÊNCIAS",GT07 - Educação de Crianças de 0 a 6 anos,39,2017-2021,http://anais.anped.org.br/sites/default/files/arquivos_18_8.
489,,CONVERSA(AÇÃO) SISTÊMICA PARA POTENCIALIZAR A (TRANS)FORMAÇÃO DE EDUCADORES AMBIENTAIS DAS INFÂNCIAS,GT22 - Educação Ambiental,39,2017-2021,http://anais.anped.org.br/sites/default/files/arquivos_19_10.
490,,INTERROGAÇÕES-CRÍTICAS À REGULAÇÃO DO MODELO DE ESCOLAS CÍVICO-MILITAR: conjecturas e perspectivas curriculares,GT05 - Estado e Política Educacional,39,2017-2021,http://anais.anped.org.br/sites/default/files/arquivos_20_10.
491,,Condições de acessibilidade e a inclusão educacional em um município sul-mato-grossense,GT15 - Educação Especial,39,2017-2021,http://anais.anped.org.br/sites/default/files/arquivos_21_8.
