,Autor(es),Título,GT,Evento,Ano,Link do Arquivo
855,,A MEDIAÇÃO ENTRE A CULTURA LITERÁRIA E O SUJEITO LEITOR: UMA REFLEXÃO A PARTIR DA TEORIA HISTÓRICO-CULTURAL,"GT10 - Alfabetização, Leitura e Escrita",39,2017-2021,http://anais.anped.org.br/sites/default/files/arquivos_36_0.
856,,O PROJETO DE EDUCAÇÃO DE JOVENS E ADULTOS DA UFMG: ASPECTOS HISTÓRICOS DE SUA CONSTITUIÇÃO E FUNCIONAMENTO,GT18 - Educação de Pessoas Jovens e Adultas,39,2017-2021,http://anais.anped.org.br/sites/default/files/arquivos_37_5.
857,,"COMUNIDADE DE PRÁTICA, AUTOFORMAÇÃO DOCENTE E JUSTIÇA SOCIAL NA ESCOLA PÚBLICA: UM ESTUDO DE CASO",GT08 - Formação de Professores,39,2017-2021,http://anais.anped.org.br/sites/default/files/arquivos_38_3.
858,,AS LITERATURAS AFRICANAS E AFRO-BRASILEIRAS – O DESAFIO DA APLICABILIDADE DA LEI 10639/2003 DE LEVAR O LEITOR A UMA VIAGEM COM OS PERSONAGENS DEUSES AFROS,GT21 - Educação e Relações Étnico-Raciais,39,2017-2021,http://anais.anped.org.br/sites/default/files/arquivos_39_2.
859,,EXPERIÊNCIAS DE EDUCADORES COM AMPLA TRAJETÓRIA NA EDUCAÇÃO DE JOVENS E ADULTOS: MEMÓRIAS E RESISTÊNCIAS.,GT18 - Educação de Pessoas Jovens e Adultas,39,2017-2021,http://anais.anped.org.br/sites/default/files/arquivos_40_0.
860,,"Afinidades eletivas, processo de racionalização e o destino da educação moderna em Max Weber",GT17 - Filosofia da Educação,39,2017-2021,http://anais.anped.org.br/sites/default/files/arquivos_41_2.
861,,ONDE FICAM AS INFÂNCIAS NA ALFABETIZAÇÃO? UMA QUESTÃO A SER PROBLEMATIZADA NO PROCESSO DE TRANSIÇÃO ENTRE AS DUAS PRIMEIRAS ETAPAS DA EDUCAÇÃO BÁSICA,GT13 - Educação Fundamental,39,2017-2021,http://anais.anped.org.br/sites/default/files/arquivos_42_6.
862,,Ser filho kaingang: modos decoloniais de educar para a vida,GT06 - Educação Popular,39,2017-2021,http://anais.anped.org.br/sites/default/files/arquivos_43_3.
863,,AS PESSOAS COM DEFICIÊNCIA VISUAL NOS PLANOS DE EDUCAÇÃO: PRESENÇAS E AUSÊNCIAS,GT15 - Educação Especial,39,2017-2021,http://anais.anped.org.br/sites/default/files/arquivos_44_2.
864,,MUSICALIZAÇÃO NA CRECHE: PRÁTICAS PEDAGÓGICAS E AS CRIAÇÕES SONORAS E MUSICAIS,GT07 - Educação de Crianças de 0 a 6 anos,39,2017-2021,http://anais.anped.org.br/sites/default/files/arquivos_45_3.
865,,CRISE TEMPORAL E TEMPO ESCOLAR. CONSIDERAÇÕES ACERCA DA ESCOLA ENQUANTO ESPAÇO-TEMPO EM UM CONTEXTO PÓS-MODERNO,GT17 - Filosofia da Educação,39,2017-2021,http://anais.anped.org.br/sites/default/files/arquivos_46_2.
866,,A FORMAÇÃO PERMANENTE DO ARTISTA-DOCENTE DE TEATRO: É PRECISO EXPERIENCIAR ARTE PARA ENSINAR ARTE?,GT24 - Educação e Arte,39,2017-2021,http://anais.anped.org.br/sites/default/files/arquivos_47_3.
867,,TURMA ELIZABETH TEIXEIRA: UM ESTUDO DE CASO SOBRE O CURSO ESPECIAL DE BACHARELADO EM DIREITO PARA BENEFICIÁRIOS DA REFORMA AGRÁRIA IMPLEMENTADO NA UEFS,"GT03 - Movimentos sociais, sujeitos e processos educativos",39,2017-2021,http://anais.anped.org.br/sites/default/files/arquivos_48_2.
868,,"EXPERIÊNCIA, APRENDIZAGEM E FORMAÇÃO: METAMORFOSES EM MOVIMENTO",GT19 - Educação Matemática,39,2017-2021,http://anais.anped.org.br/sites/default/files/arquivos_49_2.
869,,"Gênero, Quilombo, Raça e Geração: interfaces do cotidiano de mulheres quilombolas de Barrinha, Bom Jesus da Lapa, Bahia","GT23 - Gênero, Sexualidade e Educação",39,2017-2021,http://anais.anped.org.br/sites/default/files/arquivos_0_2.
870,,A PESQUISA EM EDUCAÇÃO AMBIENTAL NA DISPUTA PELA ESCOLA PÚBLICA: O MATERIALISMO HISTÓRICO-DIALÉTICO COMO FUNDAMENTO TEÓRICO-METODOLÓGICO,GT22 - Educação Ambiental,39,2017-2021,http://anais.anped.org.br/sites/default/files/arquivos_1_1.
871,,"ANTÍGONA: ANTE O SILÊNCIO E O CLAMOR DO CORO (POVO) – reflexões sobre educação, política, Estado e redes sociais",GT05 - Estado e Política Educacional,39,2017-2021,http://anais.anped.org.br/sites/default/files/arquivos_2_2.
872,,O CAMPO DA SOCIOLOGIA DA INFÂNCIA NOS PAÍSES HISPANO-FALANTES DA AMÉRICA DO SUL,GT14 - Sociologia da Educação,39,2017-2021,http://anais.anped.org.br/sites/default/files/arquivos_3_1.
873,,"A repetência e a reprovação escolar em um grupo escolar mineiro, nas primeiras décadas do século XX.",GT02 – História da Educação,39,2017-2021,http://anais.anped.org.br/sites/default/files/arquivos_4_3.
874,,RETRATOS DO COTIDIANO: DIÁLOGOS ENTRE A FORMAÇÃO DOCENTE E AS PRÁTICAS NA EDUCAÇÃO INFANTIL,GT07 - Educação de Crianças de 0 a 6 anos,39,2017-2021,http://anais.anped.org.br/sites/default/files/arquivos_5_3.
875,,A apropriação de conceitos científicos nos anos iniciais da EJA: evidências das relações entre cotidiano e atividades práticas/experimentais,GT18 - Educação de Pessoas Jovens e Adultas,39,2017-2021,http://anais.anped.org.br/sites/default/files/arquivos_6_0.
876,,ECONOMIA SOLIDÁRIAː ESPAÇO DE EDUCAÇÃO POPULAR E EMPODERAMENTO FEMININO,GT06 - Educação Popular,39,2017-2021,http://anais.anped.org.br/sites/default/files/arquivos_7_4.
877,,"“OUVINDO OS CONSELHOS DOS YOUTUBERS, EU SINTO QUE POSSO SER UM LEITOR”: OS SENTIDOS QUE OS JOVENS DAS CLASSES POPULARES ATRIBUEM AOS CANAIS DE RESENHAS LITERÁRIAS NO YOUTUBE",GT13 - Educação Fundamental,39,2017-2021,http://anais.anped.org.br/sites/default/files/arquivos_8_1.
878,,EXPERIÊNCIAS DE CRIANÇAS E O TRABALHO DOCENTE COM ANIMAÇÃO NO ENSINO DA ARTE,GT24 - Educação e Arte,39,2017-2021,http://anais.anped.org.br/sites/default/files/arquivos_9_5.
879,,Distraídos venceremos: Educação para a singularidade e abertura ao mundo,GT17 - Filosofia da Educação,39,2017-2021,http://anais.anped.org.br/sites/default/files/arquivos_10_3.
880,,A educação autônoma zapatista: um experimento cosmopolítico de democracia radical,"GT03 - Movimentos sociais, sujeitos e processos educativos",39,2017-2021,http://anais.anped.org.br/sites/default/files/arquivos_11_0.
881,,A presença de pessoas idosas na EJA: O que elas buscam? O que elas encontram?,GT18 - Educação de Pessoas Jovens e Adultas,39,2017-2021,http://anais.anped.org.br/sites/default/files/arquivos_12_0.
882,,RE)DESCOBRINDO O RIO SARACURUNA: Uma proposta interdisciplinar para abordagem do tema em Educação Ambiental,GT22 - Educação Ambiental,39,2017-2021,http://anais.anped.org.br/sites/default/files/arquivos_13_3.
883,,Povos Indígenas e Educação: estudo sobre a diversidade cultural e o estigma de ser indígena em uma Escola Municipal da Zona Rodoviária de Manaus.,GT21 - Educação e Relações Étnico-Raciais,39,2017-2021,http://anais.anped.org.br/sites/default/files/arquivos_14_0.
884,,ANÁLISE DA IMPLEMENTAÇÃO DO PROJOVEM CAMPO SABERES DA TERRA SOB A PERSPECTIVA DO MUNDO DO TRABALHO,GT05 - Estado e Política Educacional,39,2017-2021,http://anais.anped.org.br/sites/default/files/arquivos_15_2.
885,,"TRABALHO, CAPITALISMO E A PRECARIZAÇÃO DA FUNÇÃO DOCENTE",GT09 - Trabalho e Educação,39,2017-2021,http://anais.anped.org.br/sites/default/files/arquivos_16_5.
886,,"ENSINO COLABORATIVO, INCLUSÃO ESCOLAR E PRÁXIS: A PERSPECTIVA DAS PRODUÇÕES CIENTÍFICAS",GT15 - Educação Especial,39,2017-2021,http://anais.anped.org.br/sites/default/files/arquivos_17_8.
887,,A segundaPRETA: movimento negro artístico em Belo Horizonte,"GT03 - Movimentos sociais, sujeitos e processos educativos",39,2017-2021,http://anais.anped.org.br/sites/default/files/arquivos_18_0.
888,,"MOVIMENTOS SOCIAIS DE PESSOAS COM DEFICIÊNCIA, PARTICIPAÇÃO POLÍTICA E DIREITO À EDUCAÇÃO",GT15 - Educação Especial,39,2017-2021,http://anais.anped.org.br/sites/default/files/arquivos_19_9.
889,,"TIA, ESPERANÇA GARCIA SE ENCANTOU EM SEREIA ? O ECONTRO DAS HEROÍNAS NEGRAS BRASILEIRAS COM OS MITOS DE ANCESTRALIDADE AFRICANA",GT21 - Educação e Relações Étnico-Raciais,39,2017-2021,http://anais.anped.org.br/sites/default/files/arquivos_20_2.
890,,Articulação entre Educação Ambiental e direitos humanos na formação inicial de professores de Ciências e Biologia: potencialidades e limites.,GT22 - Educação Ambiental,39,2017-2021,http://anais.anped.org.br/sites/default/files/arquivos_21_2.
891,,Monitoramento participativo e tecnologia cívica na escola: participação de estudantes no controle social,GT16 - Educação e Comunicação,39,2017-2021,http://anais.anped.org.br/sites/default/files/arquivos_22_2.
892,,A COR ESCONDIDA EMBAIXO DO UNIFORME: QUEM PENSA O CURRÍCULO PARA A GERAÇÃO DO VENTRE-LIVRE?,GT12 - Currículo,39,2017-2021,http://anais.anped.org.br/sites/default/files/arquivos_23_1.
893,,A EDUCAÇÃO FÍSICA NO ENSINO MÉDIO DE UMA ESCOLA PÚBLICA DO RIO DE JANEIRO: AS DIFERENÇAS CULTURAIS EM QUESTÃO,GT04 - Didática,39,2017-2021,http://anais.anped.org.br/sites/default/files/arquivos_24_2.
894,,A POLÍTICA DE ASSISTÊNCIA ESTUDANTIL NO IFPE,GT05 - Estado e Política Educacional,39,2017-2021,http://anais.anped.org.br/sites/default/files/arquivos_25_0.
895,,Criação de um MUSEU PEDAGÓGICO NACIONAL VIRTUAL [ARTE-EDUCAÇÃO - Escolinhas de Arte do Brasil],GT24 - Educação e Arte,39,2017-2021,http://anais.anped.org.br/sites/default/files/arquivos_26_9.
896,,Democracia comunicativa e investigación deliberativa en la educación: una propuesta Deweyana,GT17 - Filosofia da Educação,39,2017-2021,http://anais.anped.org.br/sites/default/files/arquivos_27_2.
897,,QUINZE ANOS DE SINAES: CONQUISTAS E EXPECTATIVAS,GT11 - Política da Educação Superior,39,2017-2021,http://anais.anped.org.br/sites/default/files/arquivos_28_4.
898,,O OBSERVATÓRIO SOCIAL DO BRASIL COMO ARTICULADOR DE UMA DIMENSÃO DA POLÍTICA EDUCACIONAL SOB A FORMA DE REDE,GT05 - Estado e Política Educacional,39,2017-2021,http://anais.anped.org.br/sites/default/files/arquivos_29_2.
899,,Intelectuais negros(as) da APNB e do Neab AFROUNEB: produções e trajetórias antirracistas,GT21 - Educação e Relações Étnico-Raciais,39,2017-2021,http://anais.anped.org.br/sites/default/files/arquivos_30_4.
900,,"DIFERENÇA, APRENDIZAGEM E CONHECIMENTO: O lugar do saber e a luta pela emancipação com/nos/dos processos avaliativos.",GT13 - Educação Fundamental,39,2017-2021,http://anais.anped.org.br/sites/default/files/arquivos_31_0.
901,,Práticas leitoras com crianças de 0 a 3 anos de idade: o que revelam as narrativas das professoras?,GT07 - Educação de Crianças de 0 a 6 anos,39,2017-2021,http://anais.anped.org.br/sites/default/files/arquivos_32_1.
902,,SOCIALIZAÇÃO PROFISSIONAL DE DOCENTES PRINCIPIANTES NA EDUCAÇÃO SUPERIOR: DESAFIOS DA PRÁTICA PEDAGÓGICA,GT04 - Didática,39,2017-2021,http://anais.anped.org.br/sites/default/files/arquivos_33_2.
903,,ONDE ESTÃO OS JOVENS E ADULTOS NAS POLÍTICAS DE LEITURA?,GT18 - Educação de Pessoas Jovens e Adultas,39,2017-2021,http://anais.anped.org.br/sites/default/files/arquivos_34_4.
904,,AS EXPERIÊNCIAS DAS CRIANÇAS DO CAMPO: UM ESTUDO A PARTIR DA GRAMÁTICA DAS CULTURAS DA INFÂNCIA,GT07 - Educação de Crianças de 0 a 6 anos,39,2017-2021,http://anais.anped.org.br/sites/default/files/arquivos_35_3.
905,,"Cantos, danças e resistência: Processos educativos no Coral Trovadores do Vale",GT06 - Educação Popular,39,2017-2021,http://anais.anped.org.br/sites/default/files/arquivos_36_3.
906,,"ENTRELAÇAMENTOS ENTRE EDUCAÇÃO AMBIENTAL CRÍTICA, ECOLOGIA POLÍTICA E O GIRO DECOLONIAL: caminhos para uma Educação Ambiental desde el Sur",GT22 - Educação Ambiental,39,2017-2021,http://anais.anped.org.br/sites/default/files/arquivos_37_3.
907,,A MORADIA ESTUDANTIL NO CONTEXTO UNIVERSITÁRIO: APROXIMAÇÕES INTRODUTÓRIAS,GT11 - Política da Educação Superior,39,2017-2021,http://anais.anped.org.br/sites/default/files/arquivos_38_0.
908,,CORPOS MAIS: UMA PROPOSTA DE PESQUISA ARTÍSTICA E EDUCACIONAL COM NORMALISTA DO INSTITUTO DE EDUCAÇÃO CIEP 179.,GT24 - Educação e Arte,39,2017-2021,http://anais.anped.org.br/sites/default/files/arquivos_39_4.
909,,A MUDANÇA DO GESTOR EM PESQUISADOR NO PROCESSO DE PESQUISA-AÇÃO COLABORATIVO-CRÍTICA: A EDUCAÇÃO ESPECIAL EM UMA REDE DE ENSINO,GT15 - Educação Especial,39,2017-2021,http://anais.anped.org.br/sites/default/files/arquivos_40_8.
910,,Uma análise sobre a contribuição da Música Popular Brasileira (MPB) para a educação emancipatória na escola,GT24 - Educação e Arte,39,2017-2021,http://anais.anped.org.br/sites/default/files/arquivos_41_1.
911,,CÍRCULOS DE CIÊNCIAS NOS ANOS FINAIS DO ENSINO FUNDAMENTAL: UM ENCONTRO ENTRE A CONCEPÇÃO PROBLEMATIZADORA DE PAULO FREIRE E O ENSINO DE CIÊNCIAS,GT13 - Educação Fundamental,39,2017-2021,http://anais.anped.org.br/sites/default/files/arquivos_42_0.
912,,Trilhas da Educação Ambiental Crítica no contexto de um Mestrado Profissional em Educação,GT22 - Educação Ambiental,39,2017-2021,http://anais.anped.org.br/sites/default/files/arquivos_43_0.
913,,Formação de professores e sentidos de docência em currículo de Pedagogia,GT08 - Formação de Professores,39,2017-2021,http://anais.anped.org.br/sites/default/files/arquivos_44_0.
914,,Evidências de aprendizagem de estudantes com deficiência intelectual: um estudo em escola municipal paulistana,GT15 - Educação Especial,39,2017-2021,http://anais.anped.org.br/sites/default/files/arquivos_45_0.
915,,A FORMAÇÃO PEDAGÓGICA NOS CURSOS DE LICENCIATURA: o Curso de Letras da Universidade Federal do Maranhão,GT08 - Formação de Professores,39,2017-2021,http://anais.anped.org.br/sites/default/files/arquivos_46_0.
916,,"FORMAÇÃO INICIAL, INSERÇÃO E ATUAÇÃO PROFISSIONAL NA EJA",GT18 - Educação de Pessoas Jovens e Adultas,39,2017-2021,http://anais.anped.org.br/sites/default/files/arquivos_47_0.
917,,MUDANÇAS NAS POLÍTICAS DE EDUCAÇÃO SUPERIOR NO PERÍODO PÓS-IMPEACHMENT DO GOVERNO DILMA ROUSSEFF (2016-2018),GT11 - Política da Educação Superior,39,2017-2021,http://anais.anped.org.br/sites/default/files/arquivos_48_1.
918,,A FORMAÇÃO CONTINUADA DE PROFESSORES NO ENSINO FUNDAMENTAL: um estudo sobre a percepção dos professores dos projetos Expertise e Alfamat em Belém,GT13 - Educação Fundamental,39,2017-2021,http://anais.anped.org.br/sites/default/files/arquivos_49_0.
919,,"HISTÓRIA DA EDUCAÇÃO, HUMANIDADES DIGITAIS E DIVULGAÇÃO CIENTÍFICA: A BIBLIOTECA DIGITAL DE HISTÓRIA DA EDUCAÇÃO",GT02 – História da Educação,39,2017-2021,http://anais.anped.org.br/sites/default/files/arquivos_0.
920,,PROFESSORES/AS FORMANDO-SE NA COMUNICAÇÃO DE EXPERIÊNCIAS: O DESPERTAR DE RELAÇÕES DE SUBALTERNIDADE E SONHOS DE LIBERTAÇÃO,GT06 - Educação Popular,39,2017-2021,http://anais.anped.org.br/sites/default/files/arquivos_1.
921,,Introdução ao Pensamento de João dos Santos: Estudo sobre a Pedagogia Terapêutica,GT02 – História da Educação,39,2017-2021,http://anais.anped.org.br/sites/default/files/arquivos_2.
922,,"Avaliação da Educação Infantil no Brasil: debates teóricos, metodológicos e políticos.",GT07 - Educação de Crianças de 0 a 6 anos,39,2017-2021,http://anais.anped.org.br/sites/default/files/arquivos_3.
923,,"PROCESSOS EDUCATIVOS, LUTA POR DIREITOS E DESENVOLVIMENTO HUMANO EM CONTEXTOS AMAZÔNICOS",GT20 - Psicologia da Educação,39,2017-2021,http://anais.anped.org.br/sites/default/files/arquivos_4.
924,,MOVIMENTOS E MOBILIZAÇÕES FRENTE ÀS POLÍTICAS EDUCACIONAIS: REGISTROS DE LUTAS E RESISTÊNCIAS DA FAEB E DAS ASSOCIAÇÕES NACIONAIS PARA O ENSINO DA ARTE,GT24 - Educação e Arte,39,2017-2021,http://anais.anped.org.br/sites/default/files/arquivos_5.
925,,"TRÊS BRINCADEIRAS POPULARES NA EDUCAÇÃO INFANTIL EM ALAGOAS, BRASIL: um estudo das práticas performativas e pedagógicas",GT07 - Educação de Crianças de 0 a 6 anos,39,2017-2021,http://anais.anped.org.br/sites/default/files/arquivos_6.
926,,A Temática Ambiental no Programa de Formação de Educadores Ambientais,GT22 - Educação Ambiental,39,2017-2021,http://anais.anped.org.br/sites/default/files/arquivos_7.
927,,A HISTÓRIA DA INFÂNCIA NAS PRODUÇÕES ACADÊMICAS BRASILEIRAS: um mapeamento ente 2007-e 2017,GT02 – História da Educação,39,2017-2021,http://anais.anped.org.br/sites/default/files/arquivos_8.
928,,A chegada do discurso “ideologia de Gênero” no contexto educacional brasileiro.,"GT23 - Gênero, Sexualidade e Educação",39,2017-2021,http://anais.anped.org.br/sites/default/files/arquivos_9.
929,,PRÁTICAS PEDAGÓGICAS: DIÁLOGO INTERTEXTUAL ENTRE LINGUAGENS CULTURAIS E O ENSINO DE HISTÓRIA E CULTURA AFRO-BRASILEIRA E INDÍGENA,GT21 - Educação e Relações Étnico-Raciais,39,2017-2021,http://anais.anped.org.br/sites/default/files/arquivos_10.
930,,A questão racial e perspectivas outras para História da Educação,GT02 – História da Educação,39,2017-2021,http://anais.anped.org.br/sites/default/files/arquivos_11.
931,,O movimento Escola sem Partido e o contexto de precarização do Trabalho Docente no Brasil,GT09 - Trabalho e Educação,39,2017-2021,http://anais.anped.org.br/sites/default/files/arquivos_12.
932,,DIÁLOGOS ENTRE DISCIPLINAS ESCOLARES: NARRATIVAS DOCENTES SOBRE SABERES E PRÁTICAS INTERDISCIPLINARES NA EDUCAÇÃO BÁSICA,GT08 - Formação de Professores,39,2017-2021,http://anais.anped.org.br/sites/default/files/arquivos_13.
933,,DE CONVERSA EM CONVERSA: O COTIDIANO EM UMA PESQUISA NARRATIVA,GT13 - Educação Fundamental,39,2017-2021,http://anais.anped.org.br/sites/default/files/arquivos_14.
934,,O PROCESSO POLÍTICO FORMATIVO DE JOVENS ENVOLVIDOS NA COMISSÃO DE MEIO AMBIENTE E QUALIDADE DE VIDA (COM-VIDA) DE UMA COMUNIDADE/ESCOLA.,GT22 - Educação Ambiental,39,2017-2021,http://anais.anped.org.br/sites/default/files/arquivos_15.
935,,“COMO SE TORNAR O QUE SE É”. PERIÓDICOS CIENTÍFICOS DA ÁREA DA EDUCAÇÃO NA REGIÃO CENTRO OESTE BRASILEIRA,GT04 - Didática,39,2017-2021,http://anais.anped.org.br/sites/default/files/arquivos_16.
936,,Desenvolvimento da identidade de professores de matemática e participação em espaços diferenciados de formação,GT19 - Educação Matemática,39,2017-2021,http://anais.anped.org.br/sites/default/files/arquivos_17.
937,,A POLÍTICA DE CENTRALIZAÇÃO CURRICULAR NA BNCC E NA BASE NACIONAL COMUM PARA A FORMAÇÃO DE PROFESSORES,GT12 - Currículo,39,2017-2021,http://anais.anped.org.br/sites/default/files/arquivos_18.
938,,ARGUMENTOS QUE SUSTENTAM A DEFESA DA DANÇA COMO COMPONENTE CURRICULAR NA EDUCAÇÃO BÁSICA,GT24 - Educação e Arte,39,2017-2021,http://anais.anped.org.br/sites/default/files/arquivos_19.
939,,Folhinhas de Algibeira do século XIX: suas tipologias e os possíveis leitores,"GT10 - Alfabetização, Leitura e Escrita",39,2017-2021,http://anais.anped.org.br/sites/default/files/arquivos_20.
940,,Crianças e suas leituras de mundo na escrita poética,"GT10 - Alfabetização, Leitura e Escrita",39,2017-2021,http://anais.anped.org.br/sites/default/files/arquivos_21.
941,,CURRÍCULO COMO ENUNCIAÇÃO CULTURAL: UM DIÁLOGO COM HOMI BHABHA,GT12 - Currículo,39,2017-2021,http://anais.anped.org.br/sites/default/files/arquivos_22.
942,,ATRIBUIÇÃO DE SENTIDO E APRENDIZAGEM: CONTRIBUIÇÕES À DIDÁTICA DA HISTÓRIA.,GT04 - Didática,39,2017-2021,http://anais.anped.org.br/sites/default/files/arquivos_23.
943,,Práticas avaliativas no cotidiano escolar: tecendo a luta contra a produção de não-existência,GT06 - Educação Popular,39,2017-2021,http://anais.anped.org.br/sites/default/files/arquivos_24.
944,,ALFABETIZAÇÃO COMO PROCESSO DISCURSIVO: apropriação da linguagem escrita com base na interação e discursividade,"GT10 - Alfabetização, Leitura e Escrita",39,2017-2021,http://anais.anped.org.br/sites/default/files/arquivos_25.
945,,LETRAMENTO LITERÁRIO: A (IN)VISIBILIDADE DA LITERATURA PERIFÉRICO-MARGINAL NA EJA,GT18 - Educação de Pessoas Jovens e Adultas,39,2017-2021,http://anais.anped.org.br/sites/default/files/arquivos_26.
946,,OS GOVERNOS DOS CORPOS IN(FALA)NTES E AS DIRETRIZES CURRICULARES DE CAMPINAS,GT12 - Currículo,39,2017-2021,http://anais.anped.org.br/sites/default/files/arquivos_27.
947,,"Do aprendizado da obediência à humanização pelo monstro ingovernável: corpos desviantes, agir reflexivo e trabalho de si como focos de resistência na escola",GT17 - Filosofia da Educação,39,2017-2021,http://anais.anped.org.br/sites/default/files/arquivos_28.
948,,TENDÊNCIAS DO DEBATE ACERCA DA MILITARIZAÇÃO DE ESCOLAS PÚBLICAS NA PRODUÇÃO CIENTÍFICA DA ÁREA DE EDUCAÇÃO,GT05 - Estado e Política Educacional,39,2017-2021,http://anais.anped.org.br/sites/default/files/arquivos_29.
949,,DANÇA COMO ÁREA DE CONHECIMENTO NA EDUCAÇÃO BÁSICA,GT24 - Educação e Arte,39,2017-2021,http://anais.anped.org.br/sites/default/files/arquivos_30.
950,,"O LUGAR DOS MESTRES POPULARES NAS UNIVERSIDADES: UMA MIRADA DE PESQUISA, ENSINO E EXTENSÃO A PARTIR DO ENCONTRO DE SABERES",GT06 - Educação Popular,39,2017-2021,http://anais.anped.org.br/sites/default/files/arquivos_31.
951,,A imagem da mulher nas experiências pedagógicas com cinema,GT24 - Educação e Arte,39,2017-2021,http://anais.anped.org.br/sites/default/files/arquivos_32.
952,,OS PROGRAMAS DE APRENDIZAGEM PROFISSIONAL: CRÍTICA À EMPREGABILIDADE E AO EMPREENDEDORISMO COMO SOLUÇÕES PARA O DESEMPREGO JUVENIL,GT09 - Trabalho e Educação,39,2017-2021,http://anais.anped.org.br/sites/default/files/arquivos_33.
953,,A LITERATURA NO CURRÍCULO DE FORMAÇÃO DE PROFESSORAS DO PNAIC,GT12 - Currículo,39,2017-2021,http://anais.anped.org.br/sites/default/files/arquivos_34.
954,,"Temas, programas e direitos: compreendendo as demandas educacionais dos jovens rurais nas Conferências Nacionais de Juventude","GT03 - Movimentos sociais, sujeitos e processos educativos",39,2017-2021,http://anais.anped.org.br/sites/default/files/arquivos_35.
955,,Narrativas de Si: trajetórias e desafios de coordenadoras pedagógicas dos anos iniciais,GT04 - Didática,39,2017-2021,http://anais.anped.org.br/sites/default/files/arquivos_36.
956,,"""Lute como uma menina"": gênero e processos de formação na experiência das ocupações secundaristas","GT03 - Movimentos sociais, sujeitos e processos educativos",39,2017-2021,http://anais.anped.org.br/sites/default/files/arquivos_37.
957,,A LÓGICA DE MERCADO E O MUNDO DO TRABALHO NA FORMAÇÃO DE ENGENHEIROS,GT11 - Política da Educação Superior,39,2017-2021,http://anais.anped.org.br/sites/default/files/arquivos_38.
958,,"CURRÍCULO E SOCIOEDUCAÇÃO: ATAQUES, LUTAS E RESISTÊNCIAS NA PARAÍBA",GT12 - Currículo,39,2017-2021,http://anais.anped.org.br/sites/default/files/arquivos_39.
959,,DA RELAÇÃO DO ALUNO DE ESCOLAS PÚBLICAS BRASILEIRAS DE ENSINO MÉDIO COM A LEITURA LITERÁRIA: ENTRE REALIDADES E POSSIBILIDADES.,"GT10 - Alfabetização, Leitura e Escrita",39,2017-2021,http://anais.anped.org.br/sites/default/files/arquivos_40.
960,,COMPREENDENDO O SISTEMA DE NUMERAÇÃO: UMA PROPOSTA DE CÁLCULO MENTAL NO PNAIC 2014,GT19 - Educação Matemática,39,2017-2021,http://anais.anped.org.br/sites/default/files/arquivos_41.
961,,BLENDED LEARNING NO BRASIL: DO ENSINO SUPERIOR À EDUCAÇÃO BÁSICA – O QUE HÁ DE NOVO?,GT16 - Educação e Comunicação,39,2017-2021,http://anais.anped.org.br/sites/default/files/arquivos_42.
962,,OS INTERESSES DA BURGUESIA INDUSTRIAL BRASILEIRA E AS POLÍTICAS DE EDUCAÇÃO PROFISSIONAL DURANTE OS GOVERNOS PETISTAS,GT09 - Trabalho e Educação,39,2017-2021,http://anais.anped.org.br/sites/default/files/arquivos_43.
963,,PSICOLOGIA DA EDUCAÇÃO EM TEMPOS DE RECOMPOSIÇÃO NO MUNDO DO TRABALHO,GT20 - Psicologia da Educação,39,2017-2021,http://anais.anped.org.br/sites/default/files/arquivos_44.
964,,“O CELULAR É MEIO QUE O MUNDO”: VIVÊNCIAS NA CIBERCULTURA POR ADOLESCENTES,GT16 - Educação e Comunicação,39,2017-2021,http://anais.anped.org.br/sites/default/files/arquivos_45.
965,,O MERGULHO NAS PERIFERIAS: AS PRÁTICAS REESCREVENDO A HISTÓRIA DAS ESCOLAS E AS NOSSAS HISTÓRIAS,GT16 - Educação e Comunicação,39,2017-2021,http://anais.anped.org.br/sites/default/files/arquivos_46.
966,,CENTROS INTEGRADOS DE EDUCAÇÃO PÚBLICA: Uma proposta de educação e cidadania,GT02 – História da Educação,39,2017-2021,http://anais.anped.org.br/sites/default/files/arquivos_47.
967,,"TRABALHO, ESCOLA E JUVENTUDE: ESTRATÉGIAS DE CONCILIAÇÃO ENTRE TRABALHO E ESTUDO PARA JOVENS POBRES","GT03 - Movimentos sociais, sujeitos e processos educativos",39,2017-2021,http://anais.anped.org.br/sites/default/files/arquivos_48.
968,,“DEIXA EU ABRIR A JANELA” – ENCONTROS E DESENCONTROS COM A LINGUAGEM NA CRECHE,GT07 - Educação de Crianças de 0 a 6 anos,39,2017-2021,http://anais.anped.org.br/sites/default/files/arquivos_49.
969,,Docência cooperativa: modos de ensinar e aprender na relação escola-sociedade,GT13 - Educação Fundamental,40,2017-2021,http://anais.anped.org.br/sites/default/files/9060-texto_proposta_completo.pdf
970,,Formação do professor de Educação Especial no Brasil,GT15 - Educação Especial,40,2017-2021,http://anais.anped.org.br/sites/default/files/gt15-trabalho_encomendado_40rn.pdf
971,,Ciência e tecnologia no contexto de convergências de fundamentalismos: neoliberalismo extremo e guerra cultural,GT11 - Política da Educação Superior,40,2017-2021,http://anais.anped.org.br/sites/default/files/gt11-trabalho_encomendado_40rn.pdf
972,,Didática mediada pela alteridade: uma orientação emancipadora em tempos de ensino remoto emergencial,GT04 - Didática,40,2017-2021,http://anais.anped.org.br/sites/default/files/gt04-trabalho_encomendado_40rn.pdf
973,,"Movimentos sociais, sujeitos e processos educativos: 40 anos de estudos dos movimentos sociais no Brasil: aprendizagens, enigmas e desafios analíticos","GT03 - Movimentos sociais, sujeitos e processos educativos",40,2017-2021,http://anais.anped.org.br/sites/default/files/gt03-trabalho_encomendado_40rn.pdf
974,,FATORES ASSOCIADOS AO ABANDONO ESCOLAR DE JOVENS DE CLASSES BAIXAS NA REDE PÚBLICA: UMA ANÁLISE COM MÉTODOS MISTOS,,40,2017-2021,http://anais.anped.org.br/sites/default/files/gt03-trabalho_encomendado_40rn.pdf
